Authors,Title,Year,Source title,Volume,Issue,Art. No.,Page start,Page end,Page count,Link,Abstract,Author Keywords
"Bratières S., Quadrianto N., Ghahramani Z.","GPstruct: Bayesian Structured Prediction Using Gaussian Processes",2015,"IEEE Transactions on Pattern Analysis and Machine Intelligence","37","7", 6942234,"1514","1520",,"https://www.scopus.com/inward/record.uri?eid=2-s2.0-84961631731&doi=10.1109%2fTPAMI.2014.2366151&partnerID=40&md5=80d16ac0a2b9c59c858c2ca08ad208ab","We introduce a conceptually novel structured prediction model, GPstruct, which is kernelized, non-parametric and Bayesian, by design. We motivate the model with respect to existing approaches, among others, conditional random fields (CRFs), maximum margin Markov networks (M3 N), and structured support vector machines (SVMstruct), which embody only a subset of its properties. We present an inference procedure based on Markov Chain Monte Carlo. The framework can be instantiated for a wide range of structured objects such as linear chains, trees, grids, and other general graphs. As a proof of concept, the model is benchmarked on several natural language processing tasks and a video gesture segmentation task involving a linear chain structure. We show prediction accuracies for GPstruct which are comparable to or exceeding those of CRFs and SVMstruct. © 2014 IEEE.","Gaussion processes; Markov random fields; natural language processing; Statistical learning; structured prediction"
"Shabat G., Shmueli Y., Bermanis A., Averbuch A.","Accelerating Particle Filter Using Randomized Multiscale and Fast Multipole Type Methods",2015,"IEEE Transactions on Pattern Analysis and Machine Intelligence","37","7", 7010941,"1396","1407",,"https://www.scopus.com/inward/record.uri?eid=2-s2.0-84960487191&doi=10.1109%2fTPAMI.2015.2392754&partnerID=40&md5=edac8008e6cb7562ff0bc7a44f58c6d5","Particle filter is a powerful tool for state tracking using non-linear observations. We present a multiscale based method that accelerates the tracking computation by particle filters. Unlike the conventional way, which calculates weights over all particles in each cycle of the algorithm, we sample a small subset from the source particles using matrix decomposition methods. Then, we apply a function extension algorithm that uses a particle subset to recover the density function for all the rest of the particles not included in the chosen subset. The computational effort is substantial especially when multiple objects are tracked concurrently. The proposed algorithm significantly reduces the computational load. By using the Fast Gaussian Transform, the complexity of the particle selection step is reduced to a linear time in n and k, where n is the number of particles and k is the number of particles in the selected subset. We demonstrate our method on both simulated and on real data such as object tracking in video sequences. © 2015 IEEE.","fast multipole method; multiscale methods; nonlinear tracking; Particle filter"
"Takahashi T., Kurita T.","Mixture of Subspaces Image Representation and Compact Coding for Large-Scale Image Retrieval",2015,"IEEE Transactions on Pattern Analysis and Machine Intelligence","37","7", 6987339,"1469","1479",,"https://www.scopus.com/inward/record.uri?eid=2-s2.0-84960436199&doi=10.1109%2fTPAMI.2014.2382092&partnerID=40&md5=3ecdec8c2e6ab595d2607977dcf4bfaf","There are two major approaches to content-based image retrieval using local image descriptors. One is descriptor-by-descriptor matching and the other is based on comparison of global image representation that describes the set of local descriptors of each image. In large-scale problems, the latter is preferred due to its smaller memory requirements; however, it tends to be inferior to the former in terms of retrieval accuracy. To achieve both low memory cost and high accuracy, we investigate an asymmetric approach in which the probability distribution of local descriptors is modeled for each individual database image while the local descriptors of a query are used as is. We adopt a mixture model of probabilistic principal component analysis. The model parameters constitute a global image representation to be stored in database. Then the likelihood function is employed to compute a matching score between each database image and a query. We also propose an algorithm to encode our image representation into more compact codes. Experimental results demonstrate that our method can represent each database image in less than several hundred bytes achieving higher retrieval accuracy than the state-of-the-art method using Fisher vectors. © 2014 IEEE.","Image retrieval; image search; likelihood function; principal component analysis"
"Gould S.","Learning Weighted Lower Linear Envelope Potentials in Binary Markov Random Fields",2015,"IEEE Transactions on Pattern Analysis and Machine Intelligence","37","7", 6945904,"1336","1346",,"https://www.scopus.com/inward/record.uri?eid=2-s2.0-84961653976&doi=10.1109%2fTPAMI.2014.2366760&partnerID=40&md5=7e948b1e93a42f7cb49d269fe47137c5","Markov random fields containing higher-order terms are becoming increasingly popular due to their ability to capture complicated relationships as soft constraints involving many output random variables. In computer vision an important class of constraints encode a preference for label consistency over large sets of pixels and can be modeled using higher-order terms known as lower linear envelope potentials. In this paper we develop an algorithm for learning the parameters of binary Markov random fields with weighted lower linear envelope potentials. We first show how to perform exact energy minimization on these models in time polynomial in the number of variables and number of linear envelope functions. Then, with tractable inference in hand, we show how the parameters of the lower linear envelope potentials can be estimated from labeled training data within a max-margin learning framework. We explore three variants of the lower linear envelope parameterization and demonstrate results on both synthetic and real-world problems. © 2015 IEEE.","higher-order MRFs; lower linear envelope potentials; max-margin learning"
"Dikmen O., Yang Z., Oja E.","Learning the Information Divergence",2015,"IEEE Transactions on Pattern Analysis and Machine Intelligence","37","7", 6942194,"1442","1454",,"https://www.scopus.com/inward/record.uri?eid=2-s2.0-84961572671&doi=10.1109%2fTPAMI.2014.2366144&partnerID=40&md5=a1c8274e296ddac14892fb27cb4b4f42","Information divergence that measures the difference between two nonnegative matrices or tensors has found its use in a variety of machine learning problems. Examples are Nonnegative Matrix/Tensor Factorization, Stochastic Neighbor Embedding, topic models, and Bayesian network optimization. The success of such a learning task depends heavily on a suitable divergence. A large variety of divergences have been suggested and analyzed, but very few results are available for an objective choice of the optimal divergence for a given task. Here we present a framework that facilitates automatic selection of the best divergence among a given family, based on standard maximum likelihood estimation. We first propose an approximated Tweedie distribution for the β-divergence family. Selecting the best β then becomes a machine learning problem solved by maximum likelihood. Next, we reformulate α-divergence in terms of β-divergence, which enables automatic selection of α by maximum likelihood with reuse of the learning principle for β-divergence. Furthermore, we show the connections between γ- and β-divergences as well as Rényi- and α-divergences, such that our automatic selection framework is extended to non-separable divergences. Experiments on both synthetic and real-world data demonstrate that our method can quite accurately select information divergence across different learning problems and various divergence families. © 2014 IEEE.","Information divergence; maximum likelihood; nonnegative matrix factorization; stochastic neighbor embedding; tweedie distribution"
"Fix A., Gruber A., Boros E., Zabih R.","A Hypergraph-Based Reduction for Higher-Order Binary Markov Random Fields",2015,"IEEE Transactions on Pattern Analysis and Machine Intelligence","37","7", 6994862,"1387","1395",,"https://www.scopus.com/inward/record.uri?eid=2-s2.0-84960492083&doi=10.1109%2fTPAMI.2014.2382109&partnerID=40&md5=710e5fc4fbe9beefeed3fd16d35b8bfb","Higher-order Markov Random Fields, which can capture important properties of natural images, have become increasingly important in computer vision. While graph cuts work well for first-order MRF's, until recently they have rarely been effective for higher-order MRF's. Ishikawa's graph cut technique [1], [2] shows great promise for many higher-order MRF's. His method transforms an arbitrary higher-order MRF with binary labels into a first-order one with the same minima. If all the terms are submodular the exact solution can be easily found; otherwise, pseudoboolean optimization techniques can produce an optimal labeling for a subset of the variables. We present a new transformation with better performance than [1], [2], both theoretically and experimentally. While [1], [2] transforms each higher-order term independently, we use the underlying hypergraph structure of the MRF to transform a group of terms at once. For n binary variables, each of which appears in terms with k other variables, at worst we produce n non-submodular terms, while [1], [2] produces O(nk). We identify a local completeness property under which our method perform even better, and show that under certain assumptions several important vision problems (including common variants of fusion moves) have this property. We show experimentally that our method produces smaller weight of non-submodular edges, and that this metric is directly related to the effectiveness of QPBO [3]. Running on the same field of experts dataset used in [1], [2] we optimally label significantly more variables (96 versus 80 percent) and converge more rapidly to a lower energy. Preliminary experiments suggest that some other higher-order MRF's used in stereo [4] and segmentation [5] are also locally complete and would thus benefit from our work. © 2014 IEEE.","computer vision; Graph cuts; higher order priors; Markov random fields"
"Ye Q., Doermann D.","Text Detection and Recognition in Imagery: A Survey",2015,"IEEE Transactions on Pattern Analysis and Machine Intelligence","37","7", 6945320,"1480","1500",,"https://www.scopus.com/inward/record.uri?eid=2-s2.0-84961595333&doi=10.1109%2fTPAMI.2014.2366765&partnerID=40&md5=5e6ef89a6e1385771dfe584d28a92579","This paper analyzes, compares, and contrasts technical challenges, methods, and the performance of text detection and recognition research in color imagery. It summarizes the fundamental problems and enumerates factors that should be considered when addressing these problems. Existing techniques are categorized as either stepwise or integrated and sub-problems are highlighted including text localization, verification, segmentation and recognition. Special issues associated with the enhancement of degraded text and the processing of video text, multi-oriented, perspectively distorted and multilingual text are also addressed. The categories and sub-categories of text are illustrated, benchmark datasets are enumerated, and the performance of the most representative approaches is compared. This review provides a fundamental comparison and analysis of the remaining problems in the field. © 2015 IEEE.","Survey; Text Detection; Text Localization; Text Recognition"
"Guan Y., Li C.-T., Roli F.","On Reducing the Effect of Covariate Factors in Gait Recognition: A Classifier Ensemble Method",2015,"IEEE Transactions on Pattern Analysis and Machine Intelligence","37","7", 6945828,"1521","1528",,"https://www.scopus.com/inward/record.uri?eid=2-s2.0-84951875604&doi=10.1109%2fTPAMI.2014.2366766&partnerID=40&md5=37f04a1574cefcdcb4fae6d76de4741c","Robust human gait recognition is challenging because of the presence of covariate factors such as carrying condition, clothing, walking surface, etc. In this paper, we model the effect of covariates as an unknown partial feature corruption problem. Since the locations of corruptions may differ for different query gaits, relevant features may become irrelevant when walking condition changes. In this case, it is difficult to train one fixed classifier that is robust to a large number of different covariates. To tackle this problem, we propose a classifier ensemble method based on the random subspace nethod (RSM) and majority voting (MV). Its theoretical basis suggests it is insensitive to locations of corrupted features, and thus can generalize well to a large number of covariates. We also extend this method by proposing two strategies, i.e., local enhancing (LE) and hybrid decision-level fusion (HDF) to suppress the ratio of false votes to true votes (before MV). The performance of our approach is competitive against the most challenging covariates like clothing, walking surface, and elapsed time. We evaluate our method on the USF dataset and OU-ISIR-B dataset, and it has much higher performance than other state-of-the-art algorithms. © 2015 IEEE.","biometrics; Classifier ensemble; covariate factors; gait recognition; hybrid decision-level fusion; local enhancing; random subspace method"
"Komodakis N., Xiang B., Paragios N.","A Framework for Efficient Structured Max-Margin Learning of High-Order MRF Models",2015,"IEEE Transactions on Pattern Analysis and Machine Intelligence","37","7", 6951487,"1425","1441",,"https://www.scopus.com/inward/record.uri?eid=2-s2.0-84961589477&doi=10.1109%2fTPAMI.2014.2368990&partnerID=40&md5=4bd52d900ff833b280d6235e8a6b63a9","We present a very general algorithm for structured prediction learning that is able to efficiently handle discrete MRFs/CRFs (including both pairwise and higher-order models) so long as they can admit a decomposition into tractable subproblems. At its core, it relies on a dual decomposition principle that has been recently employed in the task of MRF optimization. By properly combining such an approach with a max-margin learning method, the proposed framework manages to reduce the training of a complex high-order MRF to the parallel training of a series of simple slave MRFs that are much easier to handle. This leads to a very efficient and general learning scheme that relies on solid mathematical principles. We thoroughly analyze its theoretical properties, and also show that it can yield learning algorithms of increasing accuracy since it naturally allows a hierarchy of convex relaxations to be used for loss-augmented MAP-MRF inference within a max-margin learning approach. Furthermore, it can be easily adapted to take advantage of the special structure that may be present in a given class of MRFs. We demonstrate the generality and flexibility of our approach by testing it on a variety of scenarios, including training of pairwise and higher-order MRFs, training by using different types of regularizers and/or different types of dissimilarity loss functions, as well as by learning of appropriate models for a variety of vision tasks (including high-order models for compact pose-invariant shape priors, knowledge-based segmentation, image denoising, stereo matching as well as high-order Potts MRFs). © 2015 IEEE.","Analytical models; Computational modeling; Estimation; Learning systems; Prediction algorithms; Predictive models; Training"
"Jung J., Lee J.-Y., Jeong Y., Kweon I.S.","Time-of-Flight Sensor Calibration for a Color and Depth Camera Pair",2015,"IEEE Transactions on Pattern Analysis and Machine Intelligence","37","7", 6928464,"1501","1513",,"https://www.scopus.com/inward/record.uri?eid=2-s2.0-84960928854&doi=10.1109%2fTPAMI.2014.2363827&partnerID=40&md5=7c4faaf1d2c61e5feb63561ddebd36bd","We present a calibration method of a time-of-flight (ToF) sensor and a color camera pair to align the 3D measurements with the color image correctly. We have designed a 2.5D pattern board with irregularly placed holes to be accurately detected from low resolution depth images of a ToF camera as well as from high resolution color images. In order to improve the accuracy of the 3D measurements of a ToF camera, we propose to perform ray correction and range bias correction. We reset the transformation of the ToF sensor which transforms the radial distance into the scene depth in Cartesian coordinate through ray correction. Then we capture a planar scene from different depths to correct the distance error that is shown to be dependent not only on the distance but also on the pixel location. The range error profiles along the calibrated distance are classified according to their wiggling shapes and each cluster of profiles with similar shape are separately estimated using a B-spline function. The standard deviation of the remaining random noise is recorded as an uncertainty information of distance measurements. We show the performance of our calibration method quantitatively and qualitatively on various datasets, and validate the impact of our method by demonstrating an RGB-D shape refinement application. © 2015 IEEE.","color-depth camera fusion; Kinect; time-of-flight range error analysis; Time-of-flight sensor calibration"
"Arora C., Banerjee S., Kalra P.K., Maheshwari S.N.","Generalized Flows for Optimal Inference in Higher Order MRF-MAP",2015,"IEEE Transactions on Pattern Analysis and Machine Intelligence","37","7", 7001049,"1323","1335",,"https://www.scopus.com/inward/record.uri?eid=2-s2.0-84954101538&doi=10.1109%2fTPAMI.2014.2388218&partnerID=40&md5=4bbfab875f8971bd186dd034b8e81a81","Use of higher order clique potentials in MRF-MAP problems has been limited primarily because of the inefficiencies of the existing algorithmic schemes. We propose a new combinatorial algorithm for computing optimal solutions to 2 label MRF-MAP problems with higher order clique potentials. The algorithm runs in time O(2kn3) in the worst case (k is size of clique and n is the number of pixels). A special gadget is introduced to model flows in a higher order clique and a technique for building a flow graph is specified. Based on the primal dual structure of the optimization problem, the notions of the capacity of an edge and a cut are generalized to define a flow problem. We show that in this flow graph, when the clique potentials are submodular, the max flow is equal to the min cut, which also is the optimal solution to the problem. We show experimentally that our algorithm provides significantly better solutions in practice and is hundreds of times faster than solution schemes like Dual Decomposition [1], TRWS [2] and Reduction [3], [4], [5]. The framework represents a significant advance in handling higher order problems making optimal inference practical for medium sized cliques. © 2014 IEEE.","higher order cliques; Markov random field (MRF); maximum a posteriori (MAP); optimal inference"
"Mathe S., Sminchisescu C.","Actions in the Eye: Dynamic Gaze Datasets and Learnt Saliency Models for Visual Recognition",2015,"IEEE Transactions on Pattern Analysis and Machine Intelligence","37","7", 6942210,"1408","1424",,"https://www.scopus.com/inward/record.uri?eid=2-s2.0-84961654805&doi=10.1109%2fTPAMI.2014.2366154&partnerID=40&md5=6d8e468271abb154c8ef6dea9e3e5df7","Systems based on bag-of-words models from image features collected at maxima of sparse interest point operators have been used successfully for both computer visual object and action recognition tasks. While the sparse, interest-point based approach to recognition is not inconsistent with visual processing in biological systems that operate in 'saccade and fixate' regimes, the methodology and emphasis in the human and the computer vision communities remains sharply distinct. Here, we make three contributions aiming to bridge this gap. First, we complement existing state-of-the art large scale dynamic computer vision annotated datasets like Hollywood-2 [1] and UCF Sports [2] with human eye movements collected under the ecological constraints of visual action and scene context recognition tasks. To our knowledge these are the first large human eye tracking datasets to be collected and made publicly available for video, vision.imar.ro/eyetracking (497,107 frames, each viewed by 19 subjects), unique in terms of their (a) large scale and computer vision relevance, (b) dynamic, video stimuli, (c) task control, as well as free-viewing. Second, we introduce novel dynamic consistency and alignment measures, which underline the remarkable stability of patterns of visual search among subjects. Third, we leverage the significant amount of collected data in order to pursue studies and build automatic, end-to-end trainable computer vision systems based on human eye movements. Our studies not only shed light on the differences between computer vision spatio-temporal interest point image sampling strategies and the human fixations, as well as their impact for visual recognition performance, but also demonstrate that human fixations can be accurately predicted, and when used in an end-to-end automatic system, leveraging some of the advanced computer vision practice, can lead to state of the art results. © 2014 IEEE.","consistency analysis; human eye-movements; large scale learning; saliency prediction; Visual action recognition"
"Kumar M.P., Turki H., Preston D., Koller D.","Parameter Estimation and Energy Minimization for Region-Based Semantic Segmentation",2015,"IEEE Transactions on Pattern Analysis and Machine Intelligence","37","7", 6971190,"1373","1386",,"https://www.scopus.com/inward/record.uri?eid=2-s2.0-84960453929&doi=10.1109%2fTPAMI.2014.2372766&partnerID=40&md5=2046ae7c305631d296699d8ce8da8640","We consider the problem of parameter estimation and energy minimization for a region-based semantic segmentation model. The model divides the pixels of an image into non-overlapping connected regions, each of which is to a semantic class. In the context of energy minimization, the main problem we face is the large number of putative pixel-to-region assignments. We address this problem by designing an accurate linear programming based approach for selecting the best set of regions from a large dictionary. The dictionary is constructed by merging and intersecting segments obtained from multiple bottom-up over-segmentations. The linear program is solved efficiently using dual decomposition. In the context of parameter estimation, the main problem we face is the lack of fully supervised data. We address this issue by developing a principled framework for parameter estimation using diverse data. More precisely, we propose a latent structural support vector machine formulation, where the latent variables model any missing information in the human annotation. Of particular interest to us are three types of annotations: (i) images segmented using generic foreground or background classes; (ii) images with bounding boxes specified for objects; and (iii) images labeled to indicate the presence of a class. Using large, publicly available datasets we show that our methods are able to significantly improve the accuracy of the region-based model. © 2014 IEEE.","energy minimization; LP relaxation; Semantic segmentation; weakly supervised learning"
"Werner T.","Marginal Consistency: Upper-Bounding Partition Functions over Commutative Semirings",2015,"IEEE Transactions on Pattern Analysis and Machine Intelligence","37","7", 6928491,"1455","1468",,"https://www.scopus.com/inward/record.uri?eid=2-s2.0-84960915981&doi=10.1109%2fTPAMI.2014.2363833&partnerID=40&md5=79c7d07d9708684a7ec753c0de699fca","Many inference tasks in pattern recognition and artificial intelligence lead to partition functions in which addition and multiplication are abstract binary operations forming a commutative semiring. By generalizing max-sum diffusion (one of convergent message passing algorithms for approximate MAP inference in graphical models), we propose an iterative algorithm to upper bound such partition functions over commutative semirings. The iteration of the algorithm is remarkably simple: change any two factors of the partition function such that their product remains the same and their overlapping marginals become equal. In many commutative semirings, repeating this iteration for different pairs of factors converges to a fixed point when the overlapping marginals of every pair of factors coincide. We call this state marginal consistency. During that, an upper bound on the partition function monotonically decreases. This abstract algorithm unifies several existing algorithms, including max-sum diffusion and basic costraint propagation (or local consistency) algorithms in constraint programming. We further construct a hierarchy of marginal consistencies of increasingly higher levels and show than any such level can be enforced by adding identity factors of higher arity (order). Finally, we discuss instances of the framework for several semirings, including the distributive lattice and the max-sum and sum-product semirings. © 2015 IEEE.","commutative semiring; constraint propagation; graphical model; linear programming relaxation; local consistency; Markov random field; max-sum diffusion; message passing; partition function; soft constraint satisfaction"
