Authors,Title,Year,Source title,Volume,Issue,Art. No.,Page start,Page end,Page count,Link,Abstract,Author Keywords
"Kooij J.F.P., Englebienne G., Gavrila D.M.","Mixture of Switching Linear Dynamics to Discover Behavior Patterns in Object Tracks",2016,"IEEE Transactions on Pattern Analysis and Machine Intelligence","38","2", 7121003,"322","334",,"https://www.scopus.com/inward/record.uri?eid=2-s2.0-84962092322&doi=10.1109%2fTPAMI.2015.2443801&partnerID=40&md5=f7ff62e0e53c2de1420ca2448822f743","We present a novel non-parametric Bayesian model to jointly discover the dynamics of low-level actions and high-level behaviors of tracked objects. In our approach, actions capture both linear, low-level object dynamics, and an additional spatial distribution on where the dynamic occurs. Furthermore, behavior classes capture high-level temporal motion dependencies in Markov chains of actions, thus each learned behavior is a switching linear dynamical system. The number of actions and behaviors is discovered from the data itself using Dirichlet Processes. We are especially interested in cases where tracks can exhibit large kinematic and spatial variations, e.g. person tracks in open environments, as found in the visual surveillance and intelligent vehicle domains. The model handles real-valued features directly, so no information is lost by quantizing measurements into 'visual words', and variations in standing, walking and running can be discovered without discrete thresholds. We describe inference using Markov Chain Monte Carlo sampling and validate our approach on several artificial and real-world pedestrian track datasets from the surveillance and intelligent vehicle domain. We show that our model can distinguish between relevant behavior patterns that an existing state-of-the-art hierarchical model for clustering and simpler model variants cannot. The software and the artificial and surveillance datasets are made publicly available for benchmarking purposes. © 1979-2012 IEEE.","Hierarchical non-parametric graphical model; Human behavior analysis; Switching Linear Dynamical Systems"
"Vo M., Narasimhan S.G., Sheikh Y.","Texture Illumination Separation for Single-Shot Structured Light Reconstruction",2016,"IEEE Transactions on Pattern Analysis and Machine Intelligence","38","2", 7121014,"390","404",,"https://www.scopus.com/inward/record.uri?eid=2-s2.0-84962069502&doi=10.1109%2fTPAMI.2015.2443775&partnerID=40&md5=4e9177dcb59fbdd46c89f1f6c67075de","Active illumination based methods have a trade-off between acquisition time and resolution of the estimated 3D shapes. Multi-shot approaches can generate dense reconstructions but require stationary scenes. Single-shot methods are applicable to dynamic objects but can only estimate sparse reconstructions and are sensitive to surface texture. We present a single-shot approach to produce dense shape reconstructions of highly textured objects illuminated by one or more projectors. The key to our approach is an image decomposition scheme that can recover the illumination image of different projectors and the texture images of the scene from their mixed appearances. We focus on three cases of mixed appearances: the illumination from one projector onto textured surface, illumination from multiple projectors onto a textureless surface, or their combined effect. Our method can accurately compute per-pixel warps from the illumination patterns and the texture template to the observed image. The texture template is obtained by interleaving the projection sequence with an all-white pattern. The estimated warps are reliable even with infrequent interleaved projection and strong object deformation. Thus, we obtain detailed shape reconstruction and dense motion tracking of the textured surfaces. The proposed method, implemented using a one camera and two projectors system, is validated on synthetic and real data containing subtle non-rigid surface deformations. © 1979-2012 IEEE.","decomposition; illumination; mixture; separation; Single-shot; texture"
"Ren W., Huang K., Tao D., Tan T.","Weakly Supervised Large Scale Object Localization with Multiple Instance Learning and Bag Splitting",2016,"IEEE Transactions on Pattern Analysis and Machine Intelligence","38","2", 7159101,"405","416",,"https://www.scopus.com/inward/record.uri?eid=2-s2.0-84962122607&doi=10.1109%2fTPAMI.2015.2456908&partnerID=40&md5=17c963d72a43fd57520c2dbcd9190653","Localizing objects of interest in images when provided with only image-level labels is a challenging visual recognition task. Previous efforts have required carefully designed features and have difficulty in handling images with cluttered backgrounds. Up-scaling to large datasets also poses a challenge to applying these methods to real applications. In this paper, we propose an efficient and effective learning framework called MILinear, which is able to learn an object localization model from large-scale data without using bounding box annotations. We integrate rich general prior knowledge into a learning model using a large pre-trained convolutional network. Moreover, to reduce ambiguity in positive images, we present a bag-splitting algorithm that iteratively generates new negative bags from positive ones. We evaluate the proposed approach on the challenging Pascal VOC 2007 dataset, and our method outperforms other state-of-the-art methods by a large margin; some results are even comparable to fully supervised models trained with bounding box annotations. To further demonstrate scalability, we also present detection results on the ILSVRC 2013 detection dataset, and our method outperforms supervised deformable part-based model without using box annotations. © 1979-2012 IEEE.","Convolutional networks; Multiple instance learning; Weakly supervised localization"
"Tennakoon R.B., Bab-Hadiashar A., Cao Z., Hoseinnezhad R., Suter D.","Robust Model Fitting Using Higher Than Minimal Subset Sampling",2016,"IEEE Transactions on Pattern Analysis and Machine Intelligence","38","2", 7130650,"350","362",,"https://www.scopus.com/inward/record.uri?eid=2-s2.0-84962045965&doi=10.1109%2fTPAMI.2015.2448103&partnerID=40&md5=ec329b81caa8b4461c648fa02537af2a","Identifying the underlying model in a set of data contaminated by noise and outliers is a fundamental task in computer vision. The cost function associated with such tasks is often highly complex, hence in most cases only an approximate solution is obtained by evaluating the cost function on discrete locations in the parameter (hypothesis) space. To be successful at least one hypothesis has to be in the vicinity of the solution. Due to noise hypotheses generated by minimal subsets can be far from the underlying model, even when the samples are from the said structure. In this paper we investigate the feasibility of using higher than minimal subset sampling for hypothesis generation. Our empirical studies showed that increasing the sample size beyond minimal size ($p$ ), in particular up to $p+2$ , will significantly increase the probability of generating a hypothesis closer to the true model when subsets are selected from inliers. On the other hand, the probability of selecting an all inlier sample rapidly decreases with the sample size, making direct extension of existing methods unfeasible. Hence, we propose a new computationally tractable method for robust model fitting that uses higher than minimal subsets. Here, one starts from an arbitrary hypothesis (which does not need to be in the vicinity of the solution) and moves until either a structure in data is found or the process is re-initialized. The method also has the ability to identify when the algorithm has reached a hypothesis with adequate accuracy and stops appropriately, thereby saving computational time. The experimental analysis carried out using synthetic and real data shows that the proposed method is both accurate and efficient compared to the state-of-the-art robust model fitting techniques. © 1979-2012 IEEE.","data segmentation; higher than minimal subset sampling; hypothesis generation; Model fitting; Robust Statistics"
"Zhou F., De La Torre F.","Generalized Canonical Time Warping",2016,"IEEE Transactions on Pattern Analysis and Machine Intelligence","38","2", 7062899,"279","294",,"https://www.scopus.com/inward/record.uri?eid=2-s2.0-84962071073&doi=10.1109%2fTPAMI.2015.2414429&partnerID=40&md5=c35662277e424b5fbfcd2264026ada9d","Temporal alignment of human motion has been of recent interest due to its applications in animation, tele-rehabilitation and activity recognition. This paper presents generalized canonical time warping (GCTW), an extension of dynamic time warping (DTW) and canonical correlation analysis (CCA) for temporally aligning multi-modal sequences from multiple subjects performing similar activities. GCTW extends previous work on DTW and CCA in several ways: (1) it combines CCA with DTW to align multi-modal data (e.g., video and motion capture data); (2) it extends DTW by using a linear combination of monotonic functions to represent the warping path, providing a more flexible temporal warp. Unlike exact DTW, which has quadratic complexity, we propose a linear time algorithm to minimize GCTW. (3) GCTW allows simultaneous alignment of multiple sequences. Experimental results on aligning multi-modal data, facial expressions, motion capture data and video illustrate the benefits of GCTW. The code is available at http://humansensing.cs.cmu.edu/ctw. © 1979-2012 IEEE.","Canonical correlation analysis; Dynamic time warping; Multi-modal sequence alignment"
"Liu L., Wang L., Shen C.","A Generalized Probabilistic Framework for Compact Codebook Creation",2016,"IEEE Transactions on Pattern Analysis and Machine Intelligence","38","2", 7117422,"224","237",,"https://www.scopus.com/inward/record.uri?eid=2-s2.0-84962091518&doi=10.1109%2fTPAMI.2015.2441069&partnerID=40&md5=c38d044407815d9a576a994065fc55c2","Compact and discriminative visual codebooks are preferred in many visual recognition tasks. In the literature, a number of works have taken the approach of hierarchically merging visual words of an initial large-sized codebook, but implemented this approach with different merging criteria. In this work, we propose a single probabilistic framework to unify these merging criteria, by identifying two key factors: the function used to model the class-conditional distribution and the method used to estimate the distribution parameters. More importantly, by adopting new distribution functions and/or parameter estimation methods, our framework can readily produce a spectrum of novel merging criteria. Three of them are specifically discussed in this paper. For the first criterion, we adopt the multinomial distribution with the Bayesian method; For the second criterion, we integrate the Gaussian distribution with maximum likelihood parameter estimation. For the third criterion, which shows the best merging performance, we propose a max-margin-based parameter estimation method and apply it with the multinomial distribution. Extensive experimental study is conducted to systematically analyze the performance of the above three criteria and compare them with existing ones. As demonstrated, the best criterion within our framework achieves the overall best merging performance among the compared merging criteria developed in the literature. © 1979-2012 IEEE.","Bag-of-features model; Compact codebook; Image recognition; Max-margin estimation; Probabilistic framework"
"Li A., Lin M., Wu Y., Yang M.-H., Yan S.","NUS-PRO: A New Visual Tracking Challenge",2016,"IEEE Transactions on Pattern Analysis and Machine Intelligence","38","2", 7072555,"335","349",,"https://www.scopus.com/inward/record.uri?eid=2-s2.0-84962116001&doi=10.1109%2fTPAMI.2015.2417577&partnerID=40&md5=0af78b1cd3848678c3192378b350e4c6","Numerous approaches on object tracking have been proposed during the past decade with demonstrated success. However, most tracking algorithms are evaluated on limited video sequences and annotations. For thorough performance evaluation, we propose a large-scale database which contains 365 challenging image sequences of pedestrians and rigid objects. The database covers 12 kinds of objects, and most of the sequences are captured from moving cameras. Each sequence is annotated with target location and occlusion level for evaluation. A thorough experimental evaluation of 20 state-of-the-art tracking algorithms is presented with detailed analysis using different metrics. The database is publicly available and evaluation can be carried out online for fair assessments of visual tracking algorithms. © 1979-2012 IEEE.","benchmark database; Object tracking; performance evaluation"
"Ambikasaran S., Foreman-Mackey D., Greengard L., Hogg D.W., O'Neil M.","Fast Direct Methods for Gaussian Processes",2016,"IEEE Transactions on Pattern Analysis and Machine Intelligence","38","2", 7130620,"252","265",,"https://www.scopus.com/inward/record.uri?eid=2-s2.0-84962053105&doi=10.1109%2fTPAMI.2015.2448083&partnerID=40&md5=b420bfec57972eef39e1bb5bf29051bc","A number of problems in probability and statistics can be addressed using the multivariate normal (Gaussian) distribution. In the one-dimensional case, computing the probability for a given mean and variance simply requires the evaluation of the corresponding Gaussian density. In the n -dimensional setting, however, it requires the inversion of an n × n covariance matrix, C , as well as the evaluation of its determinant, det (C). In many cases, such as regression using Gaussian processes, the covariance matrix is of the form C = σ2 I + K , where K is computed using a specified covariance kernel which depends on the data and additional parameters (hyperparameters). The matrix C is typically dense, causing standard direct methods for inversion and determinant evaluation to require O(n3) work. This cost is prohibitive for large-scale modeling. Here, we show that for the most commonly used covariance functions, the matrix C can be hierarchically factored into a product of block low-rank updates of the identity matrix, yielding an O (n2, n) algorithm for inversion. More importantly, we show that this factorization enables the evaluation of the determinant (C), permitting the direct calculation of probabilities in high dimensions under fairly broad assumptions on the kernel defining K. Our fast algorithm brings many problems in marginalization and the adaptation of hyperparameters within practical reach using a single CPU core. The combination of nearly optimal scaling in terms of problem size with high-performance computing resources will permit the modeling of previously intractable problems. We illustrate the performance of the scheme on standard covariance kernels. © 1979-2012 IEEE.","Bayesian analysis; Covariance matrix; Ction; Determinant; Direct solver; Fast multipole method; Hierarchical off-diagonal low-rank; Likelihood"
"Kolesov I., Lee J., Sharp G., Vela P., Tannenbaum A.","A Stochastic Approach to Diffeomorphic Point Set Registration with Landmark Constraints",2016,"IEEE Transactions on Pattern Analysis and Machine Intelligence","38","2", 7130637,"238","251",,"https://www.scopus.com/inward/record.uri?eid=2-s2.0-84962071093&doi=10.1109%2fTPAMI.2015.2448102&partnerID=40&md5=3dde402d3b9325b00d6cfa803e49bc4a","This work presents a deformable point set registration algorithm that seeks an optimal set of radial basis functions to describe the registration. A novel, global optimization approach is introduced composed of simulated annealing with a particle filter based generator function to perform the registration. It is shown how constraints can be incorporated into this framework. A constraint on the deformation is enforced whose role is to ensure physically meaningful fields (i.e., invertible). Further, examples in which landmark constraints serve to guide the registration are shown. Results on 2D and 3D data demonstrate the algorithm's robustness to noise and missing information. © 1979-2012 IEEE.","constrained optimization; deformable registration; Point set"
"Domokos C., Kato Z.","Realigning 2D and 3D Object Fragments without Correspondences",2016,"IEEE Transactions on Pattern Analysis and Machine Intelligence","38","1", 7138636,"195","202",,"https://www.scopus.com/inward/record.uri?eid=2-s2.0-84961572714&doi=10.1109%2fTPAMI.2015.2450726&partnerID=40&md5=11db09b53a6d6aab62e474a1bd2e9588","This paper addresses the problem of simultaneous estimation of different linear deformations, resulting in a global non-linear transformation, between an original object and its broken fragments. A general framework is proposed without using correspondences, where the solution of a polynomial system of equations directly provides the parameters of the alignment. We quantitatively evaluate the proposed algorithm on a large synthetic dataset containing 2D and 3D images, where linear (rigid-body and affine) transformations are considered. We also conduct an exhaustive analysis of the robustness against segmentation errors and the numerical stability of the proposed method. Moreover, we present experiments on 2D real images as well as on volumetric medical images. © 1979-2012 IEEE.","affine puzzle; Image registration; locally linear deformation; realignment of broken fragments"
"Girshick R., Donahue J., Darrell T., Malik J.","Region-Based Convolutional Networks for Accurate Object Detection and Segmentation",2016,"IEEE Transactions on Pattern Analysis and Machine Intelligence","38","1", 7112511,"142","158",,"https://www.scopus.com/inward/record.uri?eid=2-s2.0-84961595279&doi=10.1109%2fTPAMI.2015.2437384&partnerID=40&md5=f5625ad24a55f8ec458eadf4201f5871","Object detection performance, as measured on the canonical PASCAL VOC Challenge datasets, plateaued in the final years of the competition. The best-performing methods were complex ensemble systems that typically combined multiple low-level image features with high-level context. In this paper, we propose a simple and scalable detection algorithm that improves mean average precision (mAP) by more than 50 percent relative to the previous best result on VOC 2012 - achieving a mAP of 62.4 percent. Our approach combines two ideas: (1) one can apply high-capacity convolutional networks (CNNs) to bottom-up region proposals in order to localize and segment objects and (2) when labeled training data are scarce, supervised pre-training for an auxiliary task, followed by domain-specific fine-tuning, boosts performance significantly. Since we combine region proposals with CNNs, we call the resulting model an R-CNN or Region-based Convolutional Network. Source code for the complete system is available at http://www.cs.Berkeley.edu/rbg/rcnn. © 1979-2012 IEEE.","Convolutional Networks; Deep Learning; Detection; Object Recognition; Semantic Segmentation; Transfer Learning"
"Zhu F., Chen G., Hao J., Heng P.-A.","Blind Image Denoising via Dependent Dirichlet Process Tree",2016,"IEEE Transactions on Pattern Analysis and Machine Intelligence","PP","99", 7557070,"","",,"https://www.scopus.com/inward/record.uri?eid=2-s2.0-84988499919&doi=10.1109%2fTPAMI.2016.2604816&partnerID=40&md5=3ac99665b0ce4752017931a87e367602","Most existing image denoising approaches assumed the noise to be homogeneous white Gaussian distributed with known intensity. However, in real noisy images, the noise models are usually unknown beforehand and can be much more complex. This paper addresses this problem and proposes a novel blind image denoising algorithm to recover the clean image from noisy one with the unknown noise model. To model the empirical noise of an image, our method introduces the mixture of Gaussian distribution, which is flexible enough to approximate different continuous distributions. The problem of blind image denoising is reformulated as a learning problem. The procedure is to first build a two-layer structural model for noisy patches and consider the clean ones as latent variable. To control the complexity of the noisy patch model, this work proposes a novel Bayesian nonparametric prior called 'Dependent Dirichlet Process Tree' to build the model. Then, this study derives a variational inference algorithm to estimate model parameters and recover clean patches. We apply our method on synthesis and real noisy images with different noise models. Comparing with previous approaches, ours achieves better performance. The experimental results indicate the efficiency of the proposed algorithm to cope with practical image denoising tasks. © 1979-2012 IEEE.","Bayesian nonparametrics; Blind image denoising; dependent Dirichlet process; noise modeling; patch modeling; variational inference"
"Tumpach A.B., Drira H., Daoudi M., Srivastava A.","Gauge Invariant Framework for Shape Analysis of Surfaces",2016,"IEEE Transactions on Pattern Analysis and Machine Intelligence","38","1", 7102748,"46","59",,"https://www.scopus.com/inward/record.uri?eid=2-s2.0-84961661604&doi=10.1109%2fTPAMI.2015.2430319&partnerID=40&md5=6f66a72b5a96b027813ad921f37c51fb","This paper describes a novel framework for computing geodesic paths in shape spaces of spherical surfaces under an elastic Riemannian metric. The novelty lies in defining this Riemannian metric directly on the quotient (shape) space, rather than inheriting it from pre-shape space, and using it to formulate a path energy that measures only the normal components of velocities along the path. In other words, this paper defines and solves for geodesics directly on the shape space and avoids complications resulting from the quotient operation. This comprehensive framework is invariant to arbitrary parameterizations of surfaces along paths, a phenomenon termed as gauge invariance. Additionally, this paper makes a link between different elastic metrics used in the computer science literature on one hand, and the mathematical literature on the other hand, and provides a geometrical interpretation of the terms involved. Examples using real and simulated 3D objects are provided to help illustrate the main ideas. © 1979-2012 IEEE.","3D surfaces; geodesics; Riemannian metric"
"Brandao M., Ferreira R., Hashimoto K., Takanishi A., Santos-Victor J.","On Stereo Confidence Measures for Global Methods: Evaluation, New Model and Integration into Occupancy Grids",2016,"IEEE Transactions on Pattern Analysis and Machine Intelligence","38","1", 7112529,"116","128",,"https://www.scopus.com/inward/record.uri?eid=2-s2.0-84961578459&doi=10.1109%2fTPAMI.2015.2437381&partnerID=40&md5=9a92c6cbdbd79bb992fd21d7839f63aa","Stereo confidence measures are important functions for global reconstruction methods and some applications of stereo. In this article we evaluate and compare several models of confidence which are defined at the whole disparity range. We propose a new stereo confidence measure to which we call the Histogram Sensor Model (HSM), and show how it is one of the best performing functions overall. We also introduce, for parametric models, a systematic method for estimating their parameters which is shown to lead to better performance when compared to parameters as computed in previous literature. All models were evaluated when applied to two different cost functions at different window sizes and model parameters. Contrary to previous stereo confidence measure benchmark literature, we evaluate the models with criteria important not only to winner-take-all stereo, but also to global applications. To this end, we evaluate the models on a real-world application using a recent formulation of 3D reconstruction through occupancy grids which integrates stereo confidence at all disparities. We obtain and discuss our results on both indoors' and outdoors' publicly available datasets. © 1979-2012 IEEE.","3D reconstruction; confidence; occupancy grids; stereo matching; Stereo vision; uncertainty"
"Haene C., Zach C., Cohen A., Pollefeys M.","Dense Semantic 3D Reconstruction",2016,"IEEE Transactions on Pattern Analysis and Machine Intelligence","PP","99", 7575643,"","",,"https://www.scopus.com/inward/record.uri?eid=2-s2.0-84991658393&doi=10.1109%2fTPAMI.2016.2613051&partnerID=40&md5=4948b8c064548391d8c6eb9510b8c3b0","Both image segmentation and dense 3D modeling from images represent an intrinsically ill-posed problem. Strong regularizers are therefore required to constrain the solutions from being 'too noisy'. These priors generally yield overly smooth reconstructions and/or segmentations in certain regions while they fail to constrain the solution sufficiently in other areas. In this paper, we argue that image segmentation and dense 3D reconstruction contribute valuable information to each other's task. As a consequence, we propose a mathematical framework to formulate and solve a joint segmentation and dense reconstruction problem. On the one hand knowing about the semantic class of the geometry provides information about the likelihood of the surface direction. On the other hand the surface direction provides information about the likelihood of the semantic class. Experimental results on several data sets highlight the advantages of our joint formulation. We show how weakly observed surfaces are reconstructed more faithfully compared to a geometry only reconstruction. Thanks to the volumetric nature of our formulation we also infer surfaces which cannot be directly observed for example the surface between the ground and a building. Finally, our method returns a semantic segmentation which is consistent across the whole dataset. © 2016 IEEE.","Convex Formulation; Multi-Label Segmentation; Semantic 3D Modeling; Semantic Labeling; Volumetric Reconstruction"
