Authors,Title,Year,Source title,Volume,Issue,Art. No.,Page start,Page end,Page count,Link,Abstract,Author Keywords
"Chakraborty A., Das A., Roy-Chowdhury A.K.","Network consistent data association",2016,"IEEE Transactions on Pattern Analysis and Machine Intelligence","38","9", 7299668,"1859","1871",,"https://www.scopus.com/inward/record.uri?eid=2-s2.0-84981321191&doi=10.1109%2fTPAMI.2015.2491922&partnerID=40&md5=a75a839e81c52d77e9d684c98d47124e","Existing data association techniques mostly focus on matching pairs of data-point sets and then repeating this process along space-time to achieve long term correspondences. However, in many problems such as person re-identification, a set of data-points may be observed at multiple spatio-temporal locations and/or by multiple agents in a network and simply combining the local pairwise association results between sets of data-points often leads to inconsistencies over the global space-time horizons. In this paper, we propose a Novel Network Consistent Data Association (NCDA) framework formulated as an optimization problem that not only maintains consistency in association results across the network, but also improves the pairwise data association accuracies. The proposed NCDA can be solved as a binary integer program leading to a globally optimal solution and is capable of handling the challenging data-association scenario where the number of data-points varies across different sets of instances in the network. We also present an online implementation of NCDA method that can dynamically associate new observations to already observed data-points in an iterative fashion, while maintaining network consistency. We have tested both the batch and the online NCDA in two application areas - person re-identification and spatio-temporal cell tracking and observed consistent and highly accurate data association results in all the cases. © 1979-2012 IEEE.","Data association; integer program; network consistency; person re-identification; spatio-temporal cell tracking"
"Kong Y., Fu Y.","Max-margin action prediction machine",2016,"IEEE Transactions on Pattern Analysis and Machine Intelligence","38","9", 7299663,"1844","1858",,"https://www.scopus.com/inward/record.uri?eid=2-s2.0-84981322940&doi=10.1109%2fTPAMI.2015.2491928&partnerID=40&md5=1376bc175d1cb924acc9a98378b21f4a","The speed with which intelligent systems can react to an action depends on how soon it can be recognized. The ability to recognize ongoing actions is critical in many applications, for example, spotting criminal activity. It is challenging, since decisions have to be made based on partial videos of temporally incomplete action executions. In this paper, we propose a novel discriminative multi-scale kernelized model for predicting the action class from a partially observed video. The proposed model captures temporal dynamics of human actions by explicitly considering all the history of observed features as well as features in smaller temporal segments. A compositional kernel is proposed to hierarchically capture the relationships between partial observations as well as the temporal segments, respectively. We develop a new learning formulation, which elegantly captures the temporal evolution over time, and enforces the label consistency between segments and corresponding partial videos. We prove that the proposed learning formulation minimizes the upper bound of the empirical risk. Experimental results on four public datasets show that the proposed approach outperforms state-of-the-art action prediction methods. © 1979-2012 IEEE.","Action prediction; action recognition; composite kernel; sequential data; structured SVM"
"Dosovitskiy A., Fischer P., Springenberg J.T., Riedmiller M., Brox T.","Discriminative unsupervised feature learning with exemplar convolutional neural networks",2016,"IEEE Transactions on Pattern Analysis and Machine Intelligence","38","9", 7312476,"1734","1747",,"https://www.scopus.com/inward/record.uri?eid=2-s2.0-84981328865&doi=10.1109%2fTPAMI.2015.2496141&partnerID=40&md5=44af504379547f43a7669c96d63d2ef7","Deep convolutional networks have proven to be very successful in learning task specific features that allow for unprecedented performance on various computer vision tasks. Training of such networks follows mostly the supervised learning paradigm, where sufficiently many input-output pairs are required for training. Acquisition of large training sets is one of the key challenges, when approaching a new task. In this paper, we aim for generic feature learning and present an approach for training a convolutional network using only unlabeled data. To this end, we train the network to discriminate between a set of surrogate classes. Each surrogate class is formed by applying a variety of transformations to a randomly sampled 'seed' image patch. In contrast to supervised network training, the resulting feature representation is not class specific. It rather provides robustness to the transformations that have been applied during training. This generic feature representation allows for classification results that outperform the state of the art for unsupervised learning on several popular datasets (STL-10, CIFAR-10, Caltech-101, Caltech-256). While features learned with our approach cannot compete with class specific features from supervised training on a classification task, we show that they are advantageous on geometric matching problems, where they also outperform the SIFT descriptor. © 1979-2012 IEEE.","Convolutional networks; descriptor matching; feature learning; image classification; unsupervised learning"
"Crispim-Junior C.F., Buso V., Avgerinakis K., Meditskos G., Briassouli A., Benois-Pineau J., Kompatsiaris I.Y., Brémond F.","Semantic Event Fusion of Different Visual Modality Concepts for Activity Recognition",2016,"IEEE Transactions on Pattern Analysis and Machine Intelligence","38","8", 7423809,"1598","1611",,"https://www.scopus.com/inward/record.uri?eid=2-s2.0-84978646652&doi=10.1109%2fTPAMI.2016.2537323&partnerID=40&md5=394bfbd5c165b1fdd037976ec2dc1b3e","Combining multimodal concept streams from heterogeneous sensors is a problem superficially explored for activity recognition.Most studies explore simple sensors in nearly perfect conditions, where temporal synchronization is guaranteed.Sophisticated fusion schemes adopt problem-specific graphical representations of events that are generally deeply linked with their training data and focused on a single sensor.This paper proposes a hybrid framework between knowledge-driven and probabilistic-driven methods for event representation and recognition.It separates semantic modeling from raw sensor data by using an intermediate semantic representation, namely concepts.It introduces an algorithm for sensor alignment that uses concept similarity as a surrogate for the inaccurate temporal information of real life scenarios.Finally, it proposes the combined use of an ontology language, to overcome the rigidity of previous approaches at model definition, and a probabilistic interpretation for ontological models, which equips the framework with a mechanism to handle noisy and ambiguous concept observations, an ability that most knowledge-driven methods lack.We evaluate our contributions in multimodal recordings of elderly people carrying out IADLs.Results demonstrated that the proposed framework outperforms baseline methods both in event recognition performance and in delimiting the temporal boundaries of event instances. © 1979-2012 IEEE.","activity recognition; concept synchronization; Knowledge representation formalism and methods; multimedia perceptual system; uncertainty and probabilistic reasoning; vision and scene understanding"
"Von Marcard T., Pons-Moll G., Rosenhahn B.","Human Pose Estimation from Video and IMUs",2016,"IEEE Transactions on Pattern Analysis and Machine Intelligence","38","8", 7393844,"1533","1547",,"https://www.scopus.com/inward/record.uri?eid=2-s2.0-84978427623&doi=10.1109%2fTPAMI.2016.2522398&partnerID=40&md5=eb4fb2e0d8925dcd940350783d9aa794","In this work, we present an approach to fuse video with sparse orientation data obtained from inertial sensors to improve and stabilize full-body human motion capture. Even though video data is a strong cue for motion analysis, tracking artifacts occur frequently due to ambiguities in the images, rapid motions, occlusions or noise. As a complementary data source, inertial sensors allow for accurate estimation of limb orientations even under fast motions. However, accurate position information cannot be obtained in continuous operation. Therefore, we propose a hybrid tracker that combines video with a small number of inertial units to compensate for the drawbacks of each sensor type: on the one hand, we obtain drift-free and accurate position information from video data and, on the other hand, we obtain accurate limb orientations and good performance under fast motions from inertial sensors. In several experiments we demonstrate the increased performance and stability of our human motion tracker. © 1979-2012 IEEE.","animation; Human pose estimation; IMU; inertial sensors; motion capture; multisensor fusion"
"Roudposhti K.K., Nunes U., Dias J.","Probabilistic social behavior analysis by exploring body motion-based patterns",2016,"IEEE Transactions on Pattern Analysis and Machine Intelligence","38","8", 7312488,"1679","1691",,"https://www.scopus.com/inward/record.uri?eid=2-s2.0-84978763318&doi=10.1109%2fTPAMI.2015.2496209&partnerID=40&md5=db01d33fa9bc27fd5f8ab2a7bcd42047","Understanding human behavior through nonverbal-based features, is interesting in several applications such as surveillance, ambient assisted living and human-robot interaction. In this article in order to analyze human behaviors in social context, we propose a new approach which explores interrelations between body part motions in scenarios with people doing a conversation. The novelty of this method is that we analyze body motion-based features in frequency domain to estimate different human social patterns: Interpersonal Behaviors (IBs) and a Social Role (SR). To analyze the dynamics and interrelations of people's body motions, a human movement descriptor is used to extract discriminative features, and a multi-layer Dynamic Bayesian Network (DBN) technique is proposed to model the existent dependencies. Laban Movement Analysis (LMA) is a well-known human movement descriptor, which provides efficient mid-level information of human body motions. The mid-level information is useful to extract the complex interdependencies. The DBN technique is tested in different scenarios to model the mentioned complex dependencies. The study is applied for obtaining four IBs (Interest, Indicator, Empathy and Emphasis) to estimate one SR (Leading).The obtained results give a good indication of the capabilities of the proposed approach for people interaction analysis with potential applications in human-robot interaction. © 1979-2012 IEEE.","Bayesian approach; frequency domain; human movement analysis; social role; Social signal processing"
"Chang J.Y.","Nonparametric Feature Matching Based Conditional Random Fields for Gesture Recognition from Multi-Modal Video",2016,"IEEE Transactions on Pattern Analysis and Machine Intelligence","38","8", 7384735,"1612","1625",,"https://www.scopus.com/inward/record.uri?eid=2-s2.0-84978435071&doi=10.1109%2fTPAMI.2016.2519021&partnerID=40&md5=7f74f2c92b6e5cc985249623ca205247","We present a new gesture recognition method that is based on the conditional random field (CRF) model using multiple feature matching. Our approach solves the labeling problem, determining gesture categories and their temporal ranges at the same time. A generative probabilistic model is formalized and probability densities are nonparametrically estimated by matching input features with a training dataset. In addition to the conventional skeletal joint-based features, the appearance information near the active hand in an RGB image is exploited to capture the detailed motion of fingers. The estimated likelihood function is then used as the unary term for our CRF model. The smoothness term is also incorporated to enforce the temporal coherence of our solution. Frame-wise recognition results can then be obtained by applying an efficient dynamic programming technique. To estimate the parameters of the proposed CRF model, we incorporate the structured support vector machine (SSVM) framework that can perform efficient structured learning by using large-scale datasets. Experimental results demonstrate that our method provides effective gesture recognition results for challenging real gesture datasets. By scoring 0.8563 in the mean Jaccard index, our method has obtained the state-of-the-art results for the gesture recognition track of the 2014 ChaLearn Looking at People (LAP) Challenge. © 1979-2012 IEEE.","conditional random field; Gesture recognition; nonparametric estimation; structured learning"
"Alameda-Pineda X., Staiano J., Subramanian R., Batrinca L., Ricci E., Lepri B., Lanz O., Sebe N.","SALSA: A novel dataset for multimodal group behavior analysis",2016,"IEEE Transactions on Pattern Analysis and Machine Intelligence","38","8", 7313015,"1707","1720",,"https://www.scopus.com/inward/record.uri?eid=2-s2.0-84978760339&doi=10.1109%2fTPAMI.2015.2496269&partnerID=40&md5=44152168dc02054589ddd1fee3a96bf3","Studying free-standing conversational groups (FCGs) in unstructured social settings (e.g., cocktail party ) is gratifying due to the wealth of information available at the group (mining social networks) and individual (recognizing native behavioral and personality traits) levels. However, analyzing social scenes involving FCGs is also highly challenging due to the difficulty in extracting behavioral cues such as target locations, their speaking activity and head/body pose due to crowdedness and presence of extreme occlusions. To this end, we propose SALSA, a novel dataset facilitating multimodal and Synergetic sociAL Scene Analysis, and make two main contributions to research on automated social interaction analysis: (1) SALSA records social interactions among 18 participants in a natural, indoor environment for over 60 minutes, under the poster presentation and cocktail party contexts presenting difficulties in the form of low-resolution images, lighting variations, numerous occlusions, reverberations and interfering sound sources; (2) To alleviate these problems we facilitate multimodal analysis by recording the social interplay using four static surveillance cameras and sociometric badges worn by each participant, comprising the microphone, accelerometer, bluetooth and infrared sensors. In addition to raw data, we also provide annotations concerning individuals' personality as well as their position, head, body orientation and F-formation information over the entire event duration. Through extensive experiments with state-of-the-art approaches, we show (a) the limitations of current methods and (b) how the recorded multiple cues synergetically aid automatic analysis of social interactions. SALSA is available at http://tev.fbk.eu/salsa. © 1979-2012 IEEE.","F-formations; free-standing conversational groups; head and body pose; Multimodal group behavior analysis; multimodal social data sets; personality traits; speaker recognition; tracking"
"Wan J., Guo G., Li S.Z.","Explore Efficient Local Features from RGB-D Data for One-Shot Learning Gesture Recognition",2016,"IEEE Transactions on Pattern Analysis and Machine Intelligence","38","8", 7368923,"1626","1639",,"https://www.scopus.com/inward/record.uri?eid=2-s2.0-84978426908&doi=10.1109%2fTPAMI.2015.2513479&partnerID=40&md5=c506169a85202a90f21c436635c48bd8","Availability of handy RGB-D sensors has brought about a surge of gesture recognition research and applications. Among various approaches, one shot learning approach is advantageous because it requires minimum amount of data. Here, we provide a thorough review about one-shot learning gesture recognition from RGB-D data and propose a novel spatiotemporal feature extracted from RGB-D data, namely mixed features around sparse keypoints (MFSK). In the review, we analyze the challenges that we are facing, and point out some future research directions which may enlighten researchers in this field. The proposed MFSK feature is robust and invariant to scale, rotation and partial occlusions. To alleviate the insufficiency of one shot training samples, we augment the training samples by artificially synthesizing versions of various temporal scales, which is beneficial for coping with gestures performed at varying speed. We evaluate the proposed method on the Chalearn gesture dataset (CGD). The results show that our approach outperforms all currently published approaches on the challenging data of CGD, such as translated, scaled and occluded subsets. When applied to the RGB-D datasets that are not one-shot (e.g., the Cornell Activity Dataset-60 and MSR Daily Activity 3D dataset), the proposed feature also produces very promising results under leave-one-out cross validation or one-shot learning. © 1979-2012 IEEE.","bag of visual words model; gesture reco gnition; One-shot learning; RGB-D data"
"Corneanu C.A., Simón M.O., Cohn J.F., Guerrero S.E.","Survey on RGB, 3D, Thermal, and Multimodal Approaches for Facial Expression Recognition: History, Trends, and Affect-Related Applications",2016,"IEEE Transactions on Pattern Analysis and Machine Intelligence","38","8", 7374704,"1548","1568",,"https://www.scopus.com/inward/record.uri?eid=2-s2.0-84978370387&doi=10.1109%2fTPAMI.2016.2515606&partnerID=40&md5=e03d991b8f43cd519c346877991eb4af","Facial expressions are an important way through which humans interact socially. Building a system capable of automatically recognizing facial expressions from images and video has been an intense field of study in recent years. Interpreting such expressions remains challenging and much research is needed about the way they relate to human affect. This paper presents a general overview of automatic RGB, 3D, thermal and multimodal facial expression analysis. We define a new taxonomy for the field, encompassing all steps from face detection to facial expression recognition, and describe and classify the state of the art methods accordingly. We also present the important datasets and the bench-marking of most influential methods. We conclude with a general discussion about trends, important questions and future lines of research. © 1979-2012 IEEE.","3D; affect; emotion recognition; Facial expression; multimodal; RGB; thermal"
"Yu M., Liu L., Shao L.","Structure-preserving binary representations for RGB-D action recognition",2016,"IEEE Transactions on Pattern Analysis and Machine Intelligence","38","8", 7299652,"1651","1664",,"https://www.scopus.com/inward/record.uri?eid=2-s2.0-84978764118&doi=10.1109%2fTPAMI.2015.2491925&partnerID=40&md5=a30555abdd082ad2b9e1545510f3fbd3","In this paper, we propose a novel binary local representation for RGB-D video data fusion with a structure-preserving projection. Our contribution consists of two aspects. Toacquire a general feature for the video data, we convert the problem to describing the gradient fields of RGB and depth information of video sequences. With the local fluxes of the gradient fields, which include the orientation and the magnitude of the neighborhood of each point, a new kind of continuous local descriptor called Local Flux Feature(LFF) is obtained. Then the LFFs from RGB and depth channels are fused into a Hamming space via the Structure Preserving Projection (SPP). Specifically, an orthogonal projection matrix is applied to preserve the pairwise structure with a shape constraint to avoid the collapse of data structure in the projected space. Furthermore, a bipartite graph structure of data is taken into consideration, which is regarded as a higher level connection between samples and classes than the pairwise structure of local features. Theextensive experiments show not only the high efficiency of binary codes and the effectiveness of combining LFFs from RGB-D channels via SPP on various action recognition benchmarks of RGB-D data, but also the potential power of LFF for general action recognition. © 1979-2012 IEEE.","binary; dimensionality reduction; flux; local feature; RGB-D fusion; structure-preserving"
"Wu D., Pigou L., Kindermans P.-J., Le N.D.-H., Shao L., Dambre J., Odobez J.-M.","Deep Dynamic Neural Networks for Multimodal Gesture Segmentation and Recognition",2016,"IEEE Transactions on Pattern Analysis and Machine Intelligence","38","8", 7423804,"1583","1597",,"https://www.scopus.com/inward/record.uri?eid=2-s2.0-84978655918&doi=10.1109%2fTPAMI.2016.2537340&partnerID=40&md5=3171f2f523070d00ad9ba086c3a193e9","This paper describes a novel method called Deep Dynamic Neural Networks (DDNN) for multimodal gesture recognition. A semi-supervised hierarchical dynamic framework based on a Hidden Markov Model (HMM) is proposed for simultaneous gesture segmentation and recognition where skeleton joint information, depth and RGB images, are the multimodal input observations. Unlike most traditional approaches that rely on the construction of complex handcrafted features, our approach learns high-level spatio-temporal representations using deep neural networks suited to the input modality: a Gaussian-Bernouilli Deep Belief Network (DBN) to handle skeletal dynamics, and a 3D Convolutional Neural Network (3DCNN) to manage and fuse batches of depth and RGB images. This is achieved through the modeling and learning of the emission probabilities of the HMM required to infer the gesture sequence. This purely data driven approach achieves a Jaccard index score of 0.81 in the ChaLearn LAP gesture spotting challenge. The performance is on par with a variety of state-of-the-art hand-tuned feature-based approaches and other learning-based methods, therefore opening the door to the use of deep learning techniques in order to further explore multimodal time series data. © 1979-2012 IEEE.","convolutional neural networks; deep belief networks; Deep learning; gesture recognition; hidden Markov models"
"Zhao R., Martinez A.M.","Labeled graph kernel for behavior analysis",2016,"IEEE Transactions on Pattern Analysis and Machine Intelligence","38","8", 7274731,"1640","1650",,"https://www.scopus.com/inward/record.uri?eid=2-s2.0-84978761857&doi=10.1109%2fTPAMI.2015.2481404&partnerID=40&md5=b51aeaa58081b2d86b46d55831e3fbcb","Automatic behavior analysis from video is a major topic in many areas of research, including computer vision, multimedia, robotics, biology, cognitive science, social psychology, psychiatry, and linguistics. Two major problems are of interest when analyzing behavior. First, we wish to automatically categorize observed behaviors into a discrete set of classes (i.e., classification). For example, to determine word production from video sequences in sign language. Second, we wish to understand the relevance of each behavioral feature in achieving this classification (i.e., decoding). For instance, to know which behavior variables are used to discriminate between the words apple and onion in American Sign Language (ASL). The present paper proposes to model behavior using a labeled graph, where the nodes define behavioral features and the edges are labels specifying their order (e.g., before, overlaps, start). In this approach, classification reduces to a simple labeled graph matching. Unfortunately, the complexity of labeled graph matching grows exponentially with the number of categories we wish to represent. Here, we derive a graph kernel to quickly and accurately compute this graph similarity. This approach is very general and can be plugged into any kernel-based classifier. Specifically, we derive a Labeled Graph Support Vector Machine (LGSVM) and a Labeled Graph Logistic Regressor (LGLR) that can be readily employed to discriminate between many actions (e.g., sign language concepts). The derived approach can be readily used for decoding too, yielding invaluable information for the understanding of a problem (e.g., to know how to teach a sign language). The derived algorithms allow us to achieve higher accuracy results than those of state-of-the-art algorithms in a fraction of the time. We show experimental results on a variety of problems and datasets, including multimodal data. © 1979-2012 IEEE.","classification; computational model; decoding; Graph matching; kernel; multimodal"
