abstract,author,meta,subject,title
"This research maps the knowledge translation process for two different types
of nanotechnologies applied to cancer: liposomes and metallic nanostructures
(MNs). We performed a structural analysis of citation networks and text mining
supported in controlled vocabularies. In the case of liposomes, our results
identify subnetworks (invisible colleges) associated with different therapeutic
strategies: nanopharmacology, hyperthermia, and gene therapy. Only in the
pharmacological strategy was an organized knowledge translation process
identified, which, however, is monopolized by the liposomal doxorubicins. In
the case of MNs, subnetworks are not differentiated by the type of therapeutic
strategy, and the content of the documents is still basic research. Research on
MNs is highly focused on developing a combination of molecular imaging and
photothermal therapy.
","David Fajardo-Ortiz, Luis Duran, Laura Moreno, Hector Ochoa, Victor-M Castano","Tue, 12 Apr 2016 15:06:02 GMT (1993kb)",Digital Libraries (cs.DL),Liposomes versus metallic nanostructures: differences in the process of knowledge translation in cancer
"Earlier techniques of text mining included algorithms like k-means, Naive
Bayes, SVM which classify and cluster the text document for mining relevant
information about the documents. The need for improving the mining techniques
has us searching for techniques using the available algorithms. This paper
proposes one technique which uses the auxiliary information that is present
inside the text documents to improve the mining. This auxiliary information can
be a description to the content. This information can be either useful or
completely useless for mining. The user should assess the worth of the
auxiliary information before considering this technique for text mining. In
this paper, a combination of classical clustering algorithms is used to mine
the datasets. The algorithm runs in two stages which carry out mining at
different levels of abstraction. The clustered documents would then be
classified based on the necessary groups. The proposed technique is aimed at
improved results of document clustering.
","Jinju Joby, Jyothi Korra","Fri, 15 Apr 2016 16:27:38 GMT (891kb,D)",Information Retrieval (cs.IR),Accessing accurate documents by mining auxiliary document information
"An increasing number of people are using online social networking services
(SNSs), and a significant amount of information related to experiences in
consumption is shared in this new media form. Text mining is an emerging
technique for mining useful information from the web. We aim at discovering in
particular tweets semantic patterns in consumers' discussions on social media.
Specifically, the purposes of this study are twofold: 1) finding similarity and
dissimilarity between two sets of textual documents that include consumers'
sentiment polarities, two forms of positive vs. negative opinions and 2)
driving actual content from the textual data that has a semantic trend. The
considered tweets include consumers opinions on US retail companies (e.g.,
Amazon, Walmart). Cosine similarity and K-means clustering methods are used to
achieve the former goal, and Latent Dirichlet Allocation (LDA), a popular topic
modeling algorithm, is used for the latter purpose. This is the first study
which discover semantic properties of textual data in consumption context
beyond sentiment analysis. In addition to major findings, we apply LDA (Latent
Dirichlet Allocations) to the same data and drew latent topics that represent
consumers' positive opinions and negative opinions on social media.
","Eun Hee Ko, Diego Klabjan","Thu, 24 Mar 2016 15:22:52 GMT (623kb)",Computation and Language (cs.CL),Semantic Properties of Customer Sentiment in Tweets
"Samtla (Search And Mining Tools with Linguistic Analysis) is a digital
humanities system designed in collaboration with historians and linguists to
assist them with their research work in quantifying the content of any textual
corpora through approximate phrase search and document comparison. The
retrieval engine uses a character-based n-gram language model rather than the
conventional word-based one so as to achieve great flexibility in language
agnostic query processing.
The index is implemented as a space-optimised character-based suffix tree
with an accompanying database of document content and metadata. A number of
text mining tools are integrated into the system to allow researchers to
discover textual patterns, perform comparative analysis, and find out what is
currently popular in the research community.
Herein we describe the system architecture, user interface, models and
algorithms, and data storage of the Samtla system. We also present several case
studies of its usage in practice together with an evaluation of the systems'
ranking performance through crowdsourcing.
","Martyn Harris, Mark Levene, Dell Zhang, Dan Levene","Wed, 23 Mar 2016 12:02:12 GMT (5388kb,D)",Digital Libraries (cs.DL),The Anatomy of a Search and Mining System for Digital Archives
"Similar to other industries, the software engineering domain is plagued by
psychological diseases such as burnout, which lead developers to lose interest,
exhibit lower activity and/or feel powerless. Prevention is essential for such
diseases, which in turn requires early identification of symptoms. The
emotional dimensions of Valence, Arousal and Dominance (VAD) are able to derive
a person's interest (attraction), level of activation and perceived level of
control for a particular situation from textual communication, such as emails.
As an initial step towards identifying symptoms of productivity loss in
software engineering, this paper explores the VAD metrics and their properties
on 700,000 Jira issue reports containing over 2,000,000 comments, since issue
reports keep track of a developer's progress on addressing bugs or new
features. Using a general-purpose lexicon of 14,000 English words with known
VAD scores, our results show that issue reports of different type (e.g.,
Feature Request vs. Bug) have a fair variation of Valence, while increase in
issue priority (e.g., from Minor to Critical) typically increases Arousal.
Furthermore, we show that as an issue's resolution time increases, so does the
arousal of the individual the issue is assigned to. Finally, the resolution of
an issue increases valence, especially for the issue Reporter and for quickly
addressed issues. The existence of such relations between VAD and issue report
activities shows promise that text mining in the future could offer an
alternative way for work health assessment surveys.
","Mika M?ntyl?, Bram Adams, Giuseppe Destefanis, Daniel Graziotin, Marco Ortu","Mon, 14 Mar 2016 14:50:39 GMT (361kb,D)",Software Engineering (cs.SE),"Mining Valence, Arousal, and Dominance - Possibilities for Detecting Burnout and Productivity?"
"Intrusion Detection is one of major threats for organization. The approach of
intrusion detection using text processing has been one of research interests
which is gaining significant importance from researchers. In text mining based
approach for intrusion detection, system calls serve as source for mining and
predicting possibility of intrusion or attack. When an application runs, there
might be several system calls which are initiated in the background. These
system calls form the strong basis and the deciding factor for intrusion
detection. In this paper, we mainly discuss the approach for intrusion
detection by designing a distance measure which is designed by taking into
consideration the conventional Gaussian function and modified to suit the need
for similarity function. A Framework for intrusion detection is also discussed
as part of this research.
","Gunupudi RajeshKumar, N Mangathayaru, G Narsimha","Sat, 12 Mar 2016 01:12:08 GMT (994kb)",Cryptography and Security (cs.CR),Intrusion Detection A Text Mining Based Approach
"When looking at the structure of natural language, ""phrases"" and ""words"" are
central notions. We consider the problem of identifying such ""meaningful
subparts"" of language of any length and underlying composition principles in a
completely corpus-based and language-independent way without using any kind of
prior linguistic knowledge. Unsupervised methods for identifying ""phrases"",
mining subphrase structure and finding words in a fully automated way are
described. This can be considered as a step towards automatically computing a
""general dictionary and grammar of the corpus"". We hope that in the long run
variants of our approach turn out to be useful for other kind of sequence data
as well, such as, e.g., speech, genom sequences, or music annotation. Even if
we are not primarily interested in immediate applications, results obtained for
a variety of languages show that our methods are interesting for many practical
tasks in text mining, terminology extraction and lexicography, search engine
technology, and related fields.
","Stefan Gerdjikov, Klaus U. Schulz","Thu, 18 Feb 2016 12:08:05 GMT (679kb,D)",Computation and Language (cs.CL),Corpus analysis without prior linguistic knowledge - unsupervised mining of phrases and subphrase structure
"The information age has brought a deluge of data. Much of this is in text
form, insurmountable in scope for humans and incomprehensible in structure for
computers. Text mining is an expanding field of research that seeks to utilize
the information contained in vast document collections. General data mining
methods based on machine learning face challenges with the scale of text data,
posing a need for scalable text mining methods.
This thesis proposes a solution to scalable text mining: generative models
combined with sparse computation. A unifying formalization for generative text
models is defined, bringing together research traditions that have used
formally equivalent models, but ignored parallel developments. This framework
allows the use of methods developed in different processing tasks such as
retrieval and classification, yielding effective solutions across different
text mining tasks. Sparse computation using inverted indices is proposed for
inference on probabilistic models. This reduces the computational complexity of
the common text mining operations according to sparsity, yielding probabilistic
models with the scalability of modern search engines.
The proposed combination provides sparse generative models: a solution for
text mining that is general, effective, and scalable. Extensive experimentation
on text classification and ranked retrieval datasets are conducted, showing
that the proposed solution matches or outperforms the leading task-specific
methods in effectiveness, with a order of magnitude decrease in classification
times for Wikipedia article categorization with a million classes. The
developed methods were further applied in two 2014 Kaggle data mining prize
competitions with over a hundred competing teams, earning first and second
places.
",Antti Puurula,"Sun, 7 Feb 2016 02:49:27 GMT (4651kb,D)",Information Retrieval (cs.IR),Scalable Text Mining with Sparse Generative Models
"People are producing more written material then anytime in the history. The
increase is so high that professionals from the various fields are no more able
to cope with this amount of publications. Text mining tools can offer tools to
help them and one of the tools that can aid information retrieval and
information extraction is semantic text annotation. In this report we present
Marvin, a text annotator written in Java, which can be used as a command line
tool and as a Java library. Marvin is able to annotate text using multiple
sources, including WordNet, MetaMap, DBPedia and thesauri represented as SKOS.
",Nikola Milosevic,"Mon, 1 Feb 2016 13:27:34 GMT (217kb) [v2] Tue, 2 Feb 2016 11:31:17 GMT (218kb)",Artificial Intelligence (cs.AI),Marvin: Semantic annotation using multiple knowledge sources
"In Multiple Instance Learning (MIL) problem for sequence data, the learning
data consist of a set of bags where each bag contains a set of
instances/sequences. In many real world applications such as bioinformatics,
web mining, and text mining, comparing a random couple of sequences makes no
sense. In fact, each instance of each bag may have structural and/or temporal
relation with other instances in other bags. Thus, the classification task
should take into account the relation between semantically related instances
across bags. In this paper, we present two novel MIL approaches for sequence
data classification: (1) ABClass and (2) ABSim. In ABClass, each sequence is
represented by one vector of attributes. For each sequence of the unknown bag,
a discriminative classifier is applied in order to compute a partial
classification result. Then, an aggregation method is applied to these partial
results in order to generate the final result. In ABSim, we use a similarity
measure between each sequence of the unknown bag and the corresponding
sequences in the learning bags. An unknown bag is labeled with the bag that
presents more similar sequences. We applied both approaches to the problem of
bacterial Ionizing Radiation Resistance (IRR) prediction. We evaluated and
discussed the proposed approaches on well known Ionizing Radiation Resistance
Bacteria (IRRB) and Ionizing Radiation Sensitive Bacteria (IRSB) represented by
primary structure of basal DNA repair proteins. The experimental results show
that both ABClass and ABSim approaches are efficient.
","Manel Zoghlami, Sabeur Aridhi, Haitham Sghaier, Mondher Maddouri, Engelbert Mephu Nguifo","Sat, 30 Jan 2016 21:15:10 GMT (302kb,D)",Learning (cs.LG),A multiple instance learning approach for sequence data with across bag dependencies
"Many brokers have adapted their operation to exploit the potential of the
web. Despite the importance of the real estate classifieds, there has been
little work in analyzing such data. In this paper we propose a two-stage
regression model that exploits the textual data in real estate classifieds. We
show how our model can be used to predict the price of a real estate
classified. We also show how our model can be used to highlight keywords that
affect the price positively or negatively. To assess our contributions, we
analyze four real world data sets, which we gathered from three different
property websites. The analysis shows that our model (which exploits textual
features) achieves significantly lower root mean squared error across the
different data sets and against variety of regression models.
",Sherief Abdallah,"Sun, 15 Nov 2015 09:00:56 GMT (121kb,D)",Information Retrieval (cs.IR),Using Text Mining To Analyze Real Estate Classifieds
"In dynamic topic modeling, the proportional contribution of a topic to a
document depends on the temporal dynamics of that topic's overall prevalence in
the corpus. We extend the Dynamic Topic Model of Blei and Lafferty (2006) by
explicitly modeling document level topic proportions with covariates and
dynamic structure that includes polynomial trends and periodicity. A Markov
Chain Monte Carlo (MCMC) algorithm that utilizes Polya-Gamma data augmentation
is developed for posterior inference. Conditional independencies in the model
and sampling are made explicit, and our MCMC algorithm is parallelized where
possible to allow for inference in large corpora. To address computational
bottlenecks associated with Polya-Gamma sampling, we appeal to the Central
Limit Theorem to develop a Gaussian approximation to the Polya-Gamma random
variable. This approximation is fast and reliable for parameter values relevant
in the text mining domain. Our model and inference algorithm are validated with
multiple simulation examples, and we consider the application of modeling
trends in PubMed abstracts. We demonstrate that sharing information across
documents is critical for accurately estimating document-specific topic
proportions. We also show that explicitly modeling polynomial and periodic
behavior improves our ability to predict topic prevalence at future time
points.
","Chris Glynn, Surya T. Tokdar, David L. Banks, Brian Howard","Thu, 12 Nov 2015 16:26:13 GMT (1067kb,D)",Machine Learning (stat.ML),Bayesian Analysis of Dynamic Linear Topic Models
"The growing incidents of counterfeiting and associated economic and health
consequences necessitate the development of active surveillance systems capable
of producing timely and reliable information for all stake holders in the
anti-counterfeiting fight. User generated content from social media platforms
can provide early clues about product allergies, adverse events and product
counterfeiting. This paper reports a work in progresswith contributions
including: the development of a framework for gathering and analyzing the views
and experiences of users of drug and cosmetic products using machine learning,
text mining and sentiment analysis, the application of the proposed framework
on Facebook comments and data from Twitter for brand analysis, and the
description of how to develop a product safety lexicon and training data for
modeling a machine learning classifier for drug and cosmetic product sentiment
prediction. The initial brand and product comparison results signify the
usefulness of text mining and sentiment analysis on social media data while the
use of machine learning classifier for predicting the sentiment orientation
provides a useful tool for users, product manufacturers, regulatory and
enforcement agencies to monitor brand or product sentiment trends in order to
act in the event of sudden or significant rise in negative sentiment.
","Haruna Isah, Daniel Neagu, Paul Trundle","Sun, 18 Oct 2015 20:05:08 GMT (2852kb)",Social and Information Networks (cs.SI),Social Media Analysis for Product Safety using Text Mining and Sentiment Analysis
"Content based Document Classification is one of the biggest challenges in the
context of free text mining. Current algorithms on document classifications
mostly rely on cluster analysis based on bag-of-words approach. However that
method is still being applied to many modern scientific dilemmas. It has
established a strong presence in fields like economics and social science to
merit serious attention from the researchers. In this paper we would like to
propose and explore an alternative grounded more securely on the dictionary
classification and correlatedness of words and phrases. It is expected that
application of our existing knowledge about the underlying classification
structure may lead to improvement of the classifier's performance.
","Koushiki Sarkar, Ritwika Law","Sun, 4 Oct 2015 09:24:27 GMT (774kb) [v2] Sat, 12 Dec 2015 17:56:52 GMT (781kb)",Information Retrieval (cs.IR),A Novel Approach to Document Classification using WordNet
"Non-negative matrix factorization (NMF) is the problem of determining two
non-negative low rank factors $W$ and $H$, for the given input matrix $A$, such
that $A \approx W H$. NMF is a useful tool for many applications in different
domains such as topic modeling in text mining, background separation in video
analysis, and community detection in social networks. Despite its popularity in
the data mining community, there is a lack of efficient parallel software to
solve the problem for big datasets. Existing distributed-memory algorithms are
limited in terms of performance and applicability, as they are implemented
using Hadoop and are designed only for sparse matrices.
We propose a distributed-memory parallel algorithm that computes the
factorization by iteratively solving alternating non-negative least squares
(NLS) subproblems for $W$ and $H$. To our knowledge, our algorithm is the first
high-performance parallel algorithm for NMF. It maintains the data and factor
matrices in memory (distributed across processors), uses MPI for interprocessor
communication, and, in the dense case, provably minimizes communication costs
(under mild assumptions). As opposed to previous implementations, our algorithm
is also flexible: (1) it performs well for dense and sparse matrices, and (2)
it allows the user to choose from among multiple algorithms for solving local
NLS subproblems within the alternating iterations. We demonstrate the
scalability of our algorithm and compare it with baseline implementations,
showing significant performance improvements.
","Ramakrishnan Kannan, Grey Ballard, Haesun Park","Wed, 30 Sep 2015 19:47:39 GMT (468kb,D)","Distributed, Parallel, and Cluster Computing (cs.DC)",A High-Performance Parallel Algorithm for Nonnegative Matrix Factorization
"Text mining can be applied to many fields. One of the application is using
text mining in digital newspaper to do politic sentiment analysis. In this
paper sentiment analysis is applied to get information from digital news
articles about its positive or negative sentiment regarding particular
politician. This paper suggests a simple model to analyze digital newspaper
sentiment polarity using naive Bayes classifier method. The model uses a set of
initial data to begin with which will be updated when new information appears.
The model showed promising result when tested and can be implemented to some
other sentiment analysis problems.
","Yustinus Eko Soelistio, Martinus Raditia Sigit Surendra","Fri, 21 Aug 2015 01:40:54 GMT (592kb)",Computation and Language (cs.CL),Simple Text Mining for Sentiment Analysis of Political Figure Using Naive Bayes Classifier Method
"Using the spread of the Ice Bucket Challenge on Twitter as a case study, this
research compared the concurrent diffusion patterns of both information and
behaviors in online social networks. Individual behaviors in taking the
Challenge were detected by applying text mining techniques to millions of
tweets. After comparing diffusion dynamics of information and behaviors at the
network level, the individual level, and the dyadic level, our analysis
revealed interesting differences and interactions between the two diffusion
processes and laid foundations for future predictive and prescriptive analytics
for information and behavior diffusion in social networks.
","Shiyao Wang, Tianbo Yang, Qi Zhang, Kang Zhao","Tue, 18 Aug 2015 19:33:58 GMT (537kb)",Social and Information Networks (cs.SI),Concurrent diffusion of information and behaviors in online social networks -- a case study of the Ice Bucket Challenge
"Decision analytics commonly focuses on the text mining of financial news
sources in order to provide managerial decision support and to predict stock
market movements. Existing predictive frameworks almost exclusively apply
traditional machine learning methods, whereas recent research indicates that
traditional machine learning methods are not sufficiently capable of extracting
suitable features and capturing the non-linear nature of complex tasks. As a
remedy, novel deep learning models aim to overcome this issue by extending
traditional neural network models with additional hidden layers. Indeed, deep
learning has been shown to outperform traditional methods in terms of
predictive performance. In this paper, we adapt the novel deep learning
technique to financial decision support. In this instance, we aim to predict
the direction of stock movements following financial disclosures. As a result,
we show how deep learning can outperform the accuracy of random forests as a
benchmark for machine learning by 5.66%.
","Ralph Fehrer, Stefan Feuerriegel","Sun, 9 Aug 2015 07:39:24 GMT (626kb,D)",Machine Learning (stat.ML),Improving Decision Analytics with Deep Learning: The Case of Financial Disclosures
"To date, there have been massive Semi-Structured Documents (SSDs) during the
evolution of the Internet. These SSDs contain both unstructured features (e.g.,
plain text) and metadata (e.g., tags). Most previous works focused on modeling
the unstructured text, and recently, some other methods have been proposed to
model the unstructured text with specific tags. To build a general model for
SSDs remains an important problem in terms of both model fitness and
efficiency. We propose a novel method to model the SSDs by a so-called
Tag-Weighted Topic Model (TWTM). TWTM is a framework that leverages both the
tags and words information, not only to learn the document-topic and topic-word
distributions, but also to infer the tag-topic distributions for text mining
tasks. We present an efficient variational inference method with an EM
algorithm for estimating the model parameters. Meanwhile, we propose three
large-scale solutions for our model under the MapReduce distributed computing
platform for modeling large-scale SSDs. The experimental results show the
effectiveness, efficiency and the robustness by comparing our model with the
state-of-the-art methods in document modeling, tags prediction and text
classification. We also show the performance of the three distributed solutions
in terms of time and accuracy on document modeling.
","Shuangyin Li, Jiefei Li, Guan Huang, Ruiyang Tan, Rong Pan","Thu, 30 Jul 2015 06:44:37 GMT (654kb)",Computation and Language (cs.CL),Tag-Weighted Topic Model For Large-scale Semi-Structured Documents
