abstract,author,meta,subject,title
"Principal Component Analysis (PCA) has wide applications in machine learning,
text mining and computer vision. Classical PCA based on a Gaussian noise model
is fragile to noise of large magnitude. Laplace noise assumption based PCA
methods cannot deal with dense noise effectively. In this paper, we propose
Cauchy Principal Component Analysis (Cauchy PCA), a very simple yet effective
PCA method which is robust to various types of noise. We utilize Cauchy
distribution to model noise and derive Cauchy PCA under the maximum likelihood
estimation (MLE) framework with low rank constraint. Our method can robustly
estimate the low rank matrix regardless of whether noise is large or small,
dense or sparse. We analyze the robustness of Cauchy PCA from a robust
statistics view and present an efficient singular value projection optimization
method. Experimental results on both simulated data and real applications
demonstrate the robustness of Cauchy PCA to various noise patterns.
","Pengtao Xie, Eric Xing","Fri, 19 Dec 2014 20:06:02 GMT (1100kb,D)",Learning (cs.LG),Cauchy Principal Component Analysis
"Drug-drug interaction (DDI) is a major cause of morbidity and mortality and a
subject of intense scientific interest. Biomedical literature mining can aid
DDI research by extracting evidence for large numbers of potential interactions
from published literature and clinical databases. Though DDI is investigated in
domains ranging in scale from intracellular biochemistry to human populations,
literature mining has not been used to extract specific types of experimental
evidence, which are reported differently for distinct experimental goals. We
focus on pharmacokinetic evidence for DDI, essential for identifying causal
mechanisms of putative interactions and as input for further pharmacological
and pharmaco-epidemiology investigations. We used manually curated corpora of
PubMed abstracts and annotated sentences to evaluate the efficacy of literature
mining on two tasks: first, identifying PubMed abstracts containing
pharmacokinetic evidence of DDIs; second, extracting sentences containing such
evidence from abstracts. We implemented a text mining pipeline and evaluated it
using several linear classifiers and a variety of feature transforms. The most
important textual features in the abstract and sentence classification tasks
were analyzed. We also investigated the performance benefits of using features
derived from PubMed metadata fields, various publicly available named entity
recognizers, and pharmacokinetic dictionaries. Several classifiers performed
very well in distinguishing relevant and irrelevant abstracts (reaching
F1~=0.93, MCC~=0.74, iAUC~=0.99) and sentences (F1~=0.76, MCC~=0.65,
iAUC~=0.83). We found that word bigram features were important for achieving
optimal classifier performance and that features derived from Medical Subject
Headings (MeSH) terms significantly improved abstract classification. ...
","Artemy Kolchinsky, An?lia Louren?o, Heng-Yi Wu, Lang Li, Luis M. Rocha","Tue, 2 Dec 2014 00:01:39 GMT (967kb,D) [v2] Mon, 18 May 2015 16:45:42 GMT (621kb,D)",Machine Learning (stat.ML),Extraction of Pharmacokinetic Evidence of Drug-drug Interactions from the Literature
"This paper describes a novel approach to learning term-weighting schemes
(TWSs) in the context of text classification. In text mining a TWS determines
the way in which documents will be represented in a vector space model, before
applying a classifier. Whereas acceptable performance has been obtained with
standard TWSs (e.g., Boolean and term-frequency schemes), the definition of
TWSs has been traditionally an art. Further, it is still a difficult task to
determine what is the best TWS for a particular problem and it is not clear
yet, whether better schemes, than those currently available, can be generated
by combining known TWS. We propose in this article a genetic program that aims
at learning effective TWSs that can improve the performance of current schemes
in text classification. The genetic program learns how to combine a set of
basic units to give rise to discriminative TWSs. We report an extensive
experimental study comprising data sets from thematic and non-thematic text
classification as well as from image classification. Our study shows the
validity of the proposed method; in fact, we show that TWSs learned with the
genetic program outperform traditional schemes and other TWSs proposed in
recent works. Further, we show that TWSs learned from a specific domain can be
effectively used for other tasks.
","Hugo Jair Escalante, Mauricio A. Garc?a-Lim?n, Alicia Morales-Reyes, Mario Graff, Manuel Montes-y-G?mez, Eduardo F. Morales","Thu, 2 Oct 2014 18:38:11 GMT (161kb) [v2] Fri, 3 Oct 2014 19:47:03 GMT (161kb) [v3] Mon, 6 Oct 2014 20:48:29 GMT (161kb)",Neural and Evolutionary Computing (cs.NE),Term-Weighting Learning via Genetic Programming for Text Classification
"This paper presents a goodness-of-fit test for parametric regression models
with scalar response and directional predictor, that is, vectors in a sphere of
arbitrary dimension. The testing procedure is based on the weighted squared
distance between a smooth and a parametric regression estimator, where the
smooth regression estimator is obtained by a projected local approach.
Asymptotic behavior of the test statistic under the null hypothesis and local
alternatives is provided, jointly with a consistent bootstrap algorithm for
application in practice. A simulation study illustrates the performance of the
test in finite samples. The procedure is also applied to a real data example
from text mining.
","Eduardo Garc?a-Portugu?s, Ingrid Van Keilegom, Rosa M. Crujeiras, Wenceslao Gonz?lez-Manteiga","Mon, 1 Sep 2014 19:01:12 GMT (3457kb,D) [v2] Sun, 28 Sep 2014 03:19:22 GMT (1862kb,D) [v3] Fri, 3 Apr 2015 15:08:59 GMT (1863kb,D)",Methodology (stat.ME),Testing parametric models in linear-directional regression
"Cluster analysis is a field of data analysis that extracts underlying
patterns in data. One application of cluster analysis is in text-mining, the
analysis of large collections of text to find similarities between documents.
We used a collection of about 30,000 tweets extracted from Twitter just before
the World Cup started. A common problem with real world text data is the
presence of linguistic noise. In our case it would be extraneous tweets that
are unrelated to dominant themes. To combat this problem, we created an
algorithm that combined the DBSCAN algorithm and a consensus matrix. This way
we are left with the tweets that are related to those dominant themes. We then
used cluster analysis to find those topics that the tweets describe. We
clustered the tweets using k-means, a commonly used clustering algorithm, and
Non-Negative Matrix Factorization (NMF) and compared the results. The two
algorithms gave similar results, but NMF proved to be faster and provided more
easily interpreted results. We explored our results using two visualization
tools, Gephi and Wordle.
","Daniel Godfrey, Caley Johns, Carl Meyer, Shaina Race, Carol Sadek","Thu, 21 Aug 2014 17:58:33 GMT (2293kb,D)",Machine Learning (stat.ML),A Case Study in Text Mining: Interpreting Twitter Data From World Cup Tweets
"In the biclustering problem, we seek to simultaneously group observations and
features. While biclustering has applications in a wide array of domains,
ranging from text mining to collaborative filtering, the problem of identifying
structure in high dimensional genomic data motivates this work. In this
context, biclustering enables us to identify subsets of genes that are
co-expressed only within a subset of experimental conditions. We present a
convex formulation of the biclustering problem that possesses a unique global
minimizer and an iterative algorithm, COBRA, that is guaranteed to identify it.
Our approach generates an entire solution path of possible biclusters as a
single tuning parameter is varied. We also show how to reduce the problem of
selecting this tuning parameter to solving a trivial modification of the convex
biclustering problem. The key contributions of our work are its simplicity,
interpretability, and algorithmic guarantees - features that arguably are
lacking in the current alternative algorithms. We demonstrate the advantages of
our approach, which includes stably and reproducibly identifying biclusterings,
on simulated and real microarray data.
","Eric C. Chi, Genevera I. Allen, Richard G. Baraniuk","Tue, 5 Aug 2014 03:27:17 GMT (258kb,D) [v2] Thu, 25 Sep 2014 21:39:47 GMT (981kb,D) [v3] Fri, 29 Jan 2016 00:09:49 GMT (983kb,D) [v4] Fri, 15 Apr 2016 19:57:55 GMT (769kb,D)",Methodology (stat.ME),Convex Biclustering
"Neural network techniques are widely applied to obtain high-quality
distributed representations of words, i.e., word embeddings, to address text
mining, information retrieval, and natural language processing tasks. Recently,
efficient methods have been proposed to learn word embeddings from context that
captures both semantic and syntactic relationships between words. However, it
is challenging to handle unseen words or rare words with insufficient context.
In this paper, inspired by the study on word recognition process in cognitive
psychology, we propose to take advantage of seemingly less obvious but
essentially important morphological knowledge to address these challenges. In
particular, we introduce a novel neural network architecture called KNET that
leverages both contextual information and morphological word similarity built
based on morphological knowledge to learn word embeddings. Meanwhile, the
learning architecture is also able to refine the pre-defined morphological
knowledge and obtain more accurate word similarity. Experiments on an
analogical reasoning task and a word similarity task both demonstrate that the
proposed KNET framework can greatly enhance the effectiveness of word
embeddings.
","Qing Cui, Bin Gao, Jiang Bian, Siyu Qiu, Tie-Yan Liu","Mon, 7 Jul 2014 12:45:10 GMT (220kb,D) [v2] Mon, 1 Sep 2014 16:03:47 GMT (317kb,D) [v3] Fri, 5 Sep 2014 15:58:35 GMT (317kb,D)",Computation and Language (cs.CL),KNET: A General Framework for Learning Word Embedding using Morphological Knowledge
"We revisit the problem of predicting directional movements of stock prices
based on news articles: here our algorithm uses daily articles from The Wall
Street Journal to predict the closing stock prices on the same day. We propose
a unified latent space model to characterize the ""co-movements"" between stock
prices and news articles. Unlike many existing approaches, our new model is
able to simultaneously leverage the correlations: (a) among stock prices, (b)
among news articles, and (c) between stock prices and news articles. Thus, our
model is able to make daily predictions on more than 500 stocks (most of which
are not even mentioned in any news article) while having low complexity. We
carry out extensive backtesting on trading strategies based on our algorithm.
The result shows that our model has substantially better accuracy rate (55.7%)
compared to many widely used algorithms. The return (56%) and Sharpe ratio due
to a trading strategy based on our model are also much higher than baseline
indices.
","Felix Ming Fai Wong, Zhenming Liu, Mung Chiang","Fri, 27 Jun 2014 22:34:47 GMT (398kb,D)",Learning (cs.LG),Stock Market Prediction from WSJ: Text Mining via Sparse Matrix Factorization
"Online forums enable users to discuss together around various topics. One of
the serious problems of these environments is high volume of discussions and
thus information overload problem. Unfortunately without considering the users
interests, traditional Information Retrieval (IR) techniques are not able to
solve the problem. Therefore, employment of a Recommender System (RS) that
could suggest favorite's topics of users according to their tastes could
increases the dynamism of forum and prevent the users from duplicate posts. In
addition, consideration of semantics can be useful for increasing the
performance of IR based RS. Our goal is study of impact of ontology and data
mining techniques on improving of content-based RS. For this purpose, at first,
three type of ontologies will be constructed from the domain corpus with
utilization of text mining, Natural Language Processing (NLP) and Wordnet and
then they will be used as an input in two kind of RS: one, fully ontology-based
and one with enriching the user profile vector with ontology in vector space
model (VSM) (proposed method). Afterward the results will be compared with the
simple VSM based RS. Given results show that the proposed RS presents the
highest performance.
","Hadi Fanaee-T, Mehran Yazdi","Thu, 12 Jun 2014 16:02:16 GMT (1792kb)",Information Retrieval (cs.IR),A Semantic VSM-Based Recommender System
"In this paper we propose a general framework for learning distributed
representations of attributes: characteristics of text whose representations
can be jointly learned with word embeddings. Attributes can correspond to
document indicators (to learn sentence vectors), language indicators (to learn
distributed language representations), meta-data and side information (such as
the age, gender and industry of a blogger) or representations of authors. We
describe a third-order model where word context and attribute vectors interact
multiplicatively to predict the next word in a sequence. This leads to the
notion of conditional word similarity: how meanings of words change when
conditioned on different attributes. We perform several experimental tasks
including sentiment classification, cross-lingual document classification, and
blog authorship attribution. We also qualitatively evaluate conditional word
neighbours and attribute-conditioned text generation.
","Ryan Kiros, Richard S. Zemel, Ruslan Salakhutdinov","Tue, 10 Jun 2014 20:29:10 GMT (350kb,D)",Learning (cs.LG),A Multiplicative Model for Learning Distributed Text-Based Attribute Representations
"Service oriented architecture integrated with text mining allows services to
extract information in a well defined manner. In this paper, it is proposed to
design a knowledge extracting system for the Ocean Information Data System.
Deployed ARGO floating sensors of INCOIS (Indian National Council for Ocean
Information Systems) organization reflects the characteristics of ocean. This
is forwarded to the OIDS (Ocean Information Data System). For the data received
from OIDS, pre-processing techniques are applied. Pre-processing involves the
header retrieval and data separation. Header information is used to identify
the region of sensor, whereas data is used in the analysis process of Ocean
Information System. Analyzed data is segmented based on the region, by the
header value. Mining technique and composition principle is applied on the
segments for further analysis. Index Terms-- Service oriented architecture;
Text Mining; ARGO floating sensor; INCOIS; OIDS; Pre-processing.
","P. Ramya, S. Sasirekha","Sat, 7 Jun 2014 03:04:02 GMT (667kb)",Information Retrieval (cs.IR),Text Mining System for Non-Expert Miners
"Chinese characters have a complex and hierarchical graphical structure
carrying both semantic and phonetic information. We use this structure to
enhance the text model and obtain better results in standard NLP operations.
First of all, to tackle the problem of graphical variation we define
allographic classes of characters. Next, the relation of inclusion of a
subcharacter in a characters, provides us with a directed graph of allographic
classes. We provide this graph with two weights: semanticity (semantic relation
between subcharacter and character) and phoneticity (phonetic relation) and
calculate ""most semantic subcharacter paths"" for each character. Finally,
adding the information contained in these paths to unigrams we claim to
increase the efficiency of text mining methods. We evaluate our method on a
text classification task on two corpora (Chinese and Japanese) of a total of 18
million characters and get an improvement of 3% on an already high baseline of
89.6% precision, obtained by a linear SVM classifier. Other possible
applications and perspectives of the system are discussed.
",Yannis Haralambous,"Wed, 21 May 2014 16:49:50 GMT (2054kb)",Computation and Language (cs.CL),New Perspectives in Sinographic Language Processing Through the Use of Character Structure
"Stemming is a pre-processing step in Text Mining applications as well as a
very common requirement of Natural Language processing functions. Stemming is
the process for reducing inflected words to their stem. The main purpose of
stemming is to reduce different grammatical forms / word forms of a word like
its noun, adjective, verb, adverb etc. to its root form. Stemming is widely
uses in Information Retrieval system and reduces the size of index files. We
can say that the goal of stemming is to reduce inflectional forms and sometimes
derivationally related forms of a word to a common base form. In this paper we
have discussed different stemming algorithm for non-Indian and Indian language,
methods of stemming, accuracy and errors.
","Dalwadi Bijal, Suthar Sanket","Thu, 10 Apr 2014 17:16:01 GMT (264kb)",Computation and Language (cs.CL),Overview of Stemming Algorithms for Indian and Non-Indian Languages
"This paper proposes an information retrieval method for the economy news. The
effect of economy news, are researched in the word level and stock market
values are considered as the ground proof. The correlation between stock market
prices and economy news is an already addressed problem for most of the
countries. The most well-known approach is applying the text mining approaches
to the news and some time series analysis techniques over stock market closing
values in order to apply classification or clustering algorithms over the
features extracted. This study goes further and tries to ask the question what
are the available time series analysis techniques for the stock market closing
values and which one is the most suitable? In this study, the news and their
dates are collected into a database and text mining is applied over the news,
the text mining part has been kept simple with only term frequency-inverse
document frequency method. For the time series analysis part, we have studied
10 different methods such as random walk, moving average, acceleration,
Bollinger band, price rate of change, periodic average, difference, momentum or
relative strength index and their variation. In this study we have also
explained these techniques in a comparative way and we have applied the methods
over Turkish Stock Market closing values for more than a 2 year period. On the
other hand, we have applied the term frequency-inverse document frequency
method on the economy news of one of the high-circulating newspapers in Turkey.
","Sadi Evren Seker, Cihan Mert, Khaled Al-Naami, Nuri Ozalp, Ugur Ayan","Sat, 8 Mar 2014 19:50:15 GMT (363kb)","Computational Engineering, Finance, and Science (cs.CE)",Time Series Analysis on Stock Market for Text Mining Correlation of Economy News
"Rotationally symmetric distributions on the p-dimensional unit hypersphere,
extremely popular in directional statistics, involve a location parameter theta
that indicates the direction of the symmetry axis. The most classical way of
addressing the spherical location problem H_0:theta=theta_0, with theta_0 a
fixed location, is the so-called Watson test, which is based on the sample mean
of the observations. This test enjoys many desirable properties, but its
implementation requires the sample size n to be large compared to the dimension
p. This is a severe limitation, since more and more problems nowadays involve
high-dimensional directional data (e.g., in genetics or text mining). In this
work, we therefore introduce a modified Watson statistic that can cope with
high-dimensionality. We derive its asymptotic null distribution as both n and p
go to infinity. This is achieved in a universal asymptotic framework that
allows p to go to infinity arbitrarily fast (or slowly) as a function of n. We
further show that our results also provide high-dimensional tests for a problem
that has recently attracted much attention, namely that of testing that the
covariance matrix of a multinormal distribution has a ""theta_0-spiked""
structure. Finally, a Monte Carlo simulation study corroborates our asymptotic
results.
","Christophe Ley, Davy Paindaveine, Thomas Verdebout","Wed, 12 Feb 2014 13:56:55 GMT (546kb)",Statistics Theory (math.ST),High-dimensional tests for spherical location and spiked covariance
"Researchers and scientists increasingly find themselves in the position of
having to quickly understand large amounts of technical material. Our goal is
to effectively serve this need by using bibliometric text mining and
summarization techniques to generate summaries of scientific literature. We
show how we can use citations to produce automatically generated, readily
consumable, technical extractive summaries. We first propose C-LexRank, a model
for summarizing single scientific articles based on citations, which employs
community detection and extracts salient information-rich sentences. Next, we
further extend our experiments to summarize a set of papers, which cover the
same scientific topic. We generate extractive summaries of a set of Question
Answering (QA) and Dependency Parsing (DP) papers, their abstracts, and their
citation sentences and show that citations have unique information amenable to
creating a summary.
","Vahed Qazvinian, Dragomir R. Radev, Saif M. Mohammad, Bonnie Dorr, David Zajic, Michael Whidby, Taesun Moon","Tue, 4 Feb 2014 01:33:10 GMT (637kb)",Information Retrieval (cs.IR),Generating Extractive Summaries of Scientific Paradigms
"This study aims to publish a novel similarity metric to increase the speed of
comparison operations. Also the new metric is suitable for distance-based
operations among strings. Most of the simple calculation methods, such as
string length are fast to calculate but does not represent the string
correctly. On the other hand the methods like keeping the histogram over all
characters in the string are slower but good to represent the string
characteristics in some areas, like natural language. We propose a new metric,
easy to calculate and satisfactory for string comparison. Method is built on a
hash function, which gets a string at any size and outputs the most frequent K
characters with their frequencies. The outputs are open for comparison and our
studies showed that the success rate is quite satisfactory for the text mining
operations.
","Sadi Evren Seker, Oguz Altun, U?ur Ayan, Cihan Mert","Sat, 25 Jan 2014 23:40:46 GMT (930kb)",Data Structures and Algorithms (cs.DS),A Novel String Distance Function based on Most Frequent K Characters
"For marketing to function in a globalized world it must respect a diverse set
of local cultures. With marketing efforts extending to social media platforms,
the crossing of cultural boundaries can happen in an instant. In this paper we
examine how culture influences the popularity of marketing messages in social
media platforms. Text mining, automated translation and sentiment analysis
contribute largely to our research. From our analysis of 400 posts on the
localized Google+ pages of German car brands in Germany and the US, we conclude
that posting time and emotions are important predictors for reshare counts.
","Ronald Hochreiter, Christoph Waldhauser","Wed, 22 Jan 2014 16:41:27 GMT (57kb,D) [v2] Wed, 16 Apr 2014 16:05:10 GMT (603kb)",Social and Information Networks (cs.SI),Data Mining Cultural Aspects of Social Media Marketing
"Nonnegative matrix factorization (NMF) has become a widely used tool for the
analysis of high-dimensional data as it automatically extracts sparse and
meaningful features from a set of nonnegative data vectors. We first illustrate
this property of NMF on three applications, in image processing, text mining
and hyperspectral imaging --this is the why. Then we address the problem of
solving NMF, which is NP-hard in general. We review some standard NMF
algorithms, and also present a recent subclass of NMF problems, referred to as
near-separable NMF, that can be solved efficiently (that is, in polynomial
time), even in the presence of noise --this is the how. Finally, we briefly
describe some problems in mathematics and computer science closely related to
NMF via the nonnegative rank.
",Nicolas Gillis,"Tue, 21 Jan 2014 09:03:12 GMT (2058kb) [v2] Fri, 7 Mar 2014 10:32:43 GMT (2064kb)",Machine Learning (stat.ML),The Why and How of Nonnegative Matrix Factorization
