abstract,author,meta,subject,title
"Matrix approximation is a common tool in machine learning for building
accurate prediction models for recommendation systems, text mining, and
computer vision. A prevalent assumption in constructing matrix approximations
is that the partially observed matrix is of low-rank. We propose a new matrix
approximation model where we assume instead that the matrix is only locally of
low-rank, leading to a representation of the observed matrix as a weighted sum
of low-rank matrices. We analyze the accuracy of the proposed local low-rank
modeling. Our experiments show improvements in prediction accuracy in
recommendation tasks.
","Joonseok Lee, Seungyeon Kim, Guy Lebanon, Yoram Singer","Tue, 15 Jan 2013 00:54:38 GMT (313kb,D)",Learning (cs.LG),Matrix Approximation under Local Low-Rank Assumption
"Representation of semantic information contained in the words is needed for
any Arabic Text Mining applications. More precisely, the purpose is to better
take into account the semantic dependencies between words expressed by the
co-occurrence frequencies of these words. There have been many proposals to
compute similarities between words based on their distributions in contexts. In
this paper, we compare and contrast the effect of two preprocessing techniques
applied to Arabic corpus: Rootbased (Stemming), and Stem-based (Light Stemming)
approaches for measuring the similarity between Arabic words with the well
known abstractive model -Latent Semantic Analysis (LSA)- with a wide variety of
distance functions and similarity measures, such as the Euclidean Distance,
Cosine Similarity, Jaccard Coefficient, and the Pearson Correlation
Coefficient. The obtained results show that, on the one hand, the variety of
the corpus produces more accurate results; on the other hand, the Stem-based
approach outperformed the Root-based one because this latter affects the words
meanings.
","Hanane Froud, Abdelmonaim Lachkar, Said Alaoui Ouatik","Fri, 14 Dec 2012 23:34:07 GMT (250kb)",Computation and Language (cs.CL),A comparative study of root-based and stem-based approaches for measuring the similarity between arabic words for arabic text mining applications
"What characterizes influential users in online health communities (OHCs)? We
hypothesize that (1) the emotional support received by OHC members can be
assessed from their sentiment ex-pressed in online interactions, and (2) such
assessments can help to identify influential OHC members. Through text mining
and sentiment analysis of users' online interactions, we propose a novel metric
that directly measures a user's ability to affect the sentiment of others.
Using dataset from an OHC, we demonstrate that this metric is highly effective
in identifying influential users. In addition, combining the metric with other
traditional measures further improves the identification of influential users.
This study can facilitate online community management and advance our
understanding of social influence in OHCs.
","Kang Zhao, Greta Greer, Baojun Qiu, Prasenjit Mitra, Kenneth Portier, John Yen","Mon, 26 Nov 2012 20:37:00 GMT (562kb) [v2] Wed, 5 Dec 2012 23:12:05 GMT (563kb)",Social and Information Networks (cs.SI),Finding influential users of an online health community: a new metric based on sentiment influence
"The criminal nature of narcotics complicates the direct assessment of a drug
community, while having a good understanding of the type of people drawn or
currently using drugs is vital for finding effective intervening strategies.
Especially for the Russian Federation this is of immediate concern given the
dramatic increase it has seen in drug abuse since the fall of the Soviet Union
in the early nineties. Using unique data from the Russian social network
'LiveJournal' with over 39 million registered users worldwide, we were able for
the first time to identify the on-line drug community by context sensitive text
mining of the users' blogs using a dictionary of known drug-related official
and 'slang' terminology. By comparing the interests of the users that most
actively spread information on narcotics over the network with the interests of
the individuals outside the on-line drug community, we found that the 'average'
drug user in the Russian Federation is generally mostly interested in topics
such as Russian rock, non-traditional medicine, UFOs, Buddhism, yoga and the
occult. We identify three distinct scale-free sub-networks of users which can
be uniquely classified as being either 'infectious', 'susceptible' or 'immune'.
","L. J. Dijkstra, A. V. Yakushev, P. A. C. Duijn, A. V. Boukhanovsky, P. M. A. Sloot","Tue, 20 Nov 2012 15:46:35 GMT (1765kb) [v2] Mon, 10 Dec 2012 09:39:30 GMT (1766kb) [v3] Mon, 13 May 2013 16:02:14 GMT (1766kb)",Social and Information Networks (cs.SI),Inference of the Russian drug community from one of the largest social networks in the Russian Federation
"This paper introduces a new similarity measure based on edge counting in a
taxonomy like WorldNet or Ontology. Measurement of similarity between text
segments or concepts is very useful for many applications like information
retrieval, ontology matching, text mining, and question answering and so on.
Several measures have been developed for measuring similarity between two
concepts: out of these we see that the measure given by Wu and Palmer [1] is
simple, and gives good performance. Our measure is based on their measure but
strengthens it. Wu and Palmer [1] measure has a disadvantage that it does not
consider how far the concepts are semantically. In our measure we include the
shortest path between the concepts and the depth of whole taxonomy together
with the distances used in Wu and Palmer [1]. Also the measure has following
disadvantage i.e. in some situations, the similarity of two elements of an IS-A
ontology contained in the neighborhood exceeds the similarity value of two
elements contained in the same hierarchy. Our measure introduces a penalization
factor for this case based upon shortest length between the concepts and depth
of whole taxonomy.
","Manjula Shenoy.K, K.C.Shet, U.Dinesh Acharya","Tue, 20 Nov 2012 10:53:22 GMT (154kb)",Artificial Intelligence (cs.AI),A New Similarity Measure for Taxonomy Based on Edge Counting
"The term legal research generally refers to the process of identifying and
retrieving appropriate information necessary to support legal decision making
from past case records. At present, the process is mostly manual, but some
traditional technologies such as keyword searching are commonly used to speed
the process up. But a keyword search is not a comprehensive search to cater to
the requirements of legal research as the search result includes too many false
hits in terms of irrelevant case records. Hence the present generic tools
cannot be used to automate legal research.
This paper presents a framework which was developed by combining several Text
Mining techniques to automate the process overcoming the difficulties in the
existing methods. Further, the research also identifies the possible
enhancements that could be done to enhance the effectiveness of the framework.
",Mohamed Firdhous,"Thu, 8 Nov 2012 14:19:49 GMT (424kb)",Information Retrieval (cs.IR),Automating Legal Research through Data Mining
"In many real-world applications such as text mining, it is desirable to
select the most relevant features or variables to improve the generalization
ability, or to provide a better interpretation of the prediction models. {In
this paper, a novel adaptive feature scaling (AFS) scheme is proposed by
introducing a feature scaling {vector $\d \in [0, 1]^m$} to alleviate the bias
problem brought by the scaling bias of the diverse features.} By reformulating
the resultant AFS model to semi-infinite programming problem, a novel feature
generating method is presented to identify the most relevant features for
classification problems. In contrast to the traditional feature selection
methods, the new formulation has the advantage of solving extremely
high-dimensional and large-scale problems. With an exact solution to the
worst-case analysis in the identification of relevant features, the proposed
feature generating scheme converges globally. More importantly, the proposed
scheme facilitates the group selection with or without special structures.
Comprehensive experiments on a wide range of synthetic and real-world datasets
demonstrate that the proposed method {achieves} better or competitive
performance compared with the existing methods on (group) feature selection in
terms of generalization performance and training efficiency. The C++ and MATLAB
implementations of our algorithm can be available at
\emph{this http URL}.
","Mingkui Tan, Ivor W. Tsang, Li Wang","Mon, 24 Sep 2012 13:23:39 GMT (342kb)",Learning (cs.LG),Towards Large-scale and Ultrahigh Dimensional Feature Selection via Feature Generation
"A major computational burden, while performing document clustering, is the
calculation of similarity measure between a pair of documents. Similarity
measure is a function that assign a real number between 0 and 1 to a pair of
documents, depending upon the degree of similarity between them. A value of
zero means that the documents are completely dissimilar whereas a value of one
indicates that the documents are practically identical. Traditionally,
vector-based models have been used for computing the document similarity. The
vector-based models represent several features present in documents. These
approaches to similarity measures, in general, cannot account for the semantics
of the document. Documents written in human languages contain contexts and the
words used to describe these contexts are generally semantically related.
Motivated by this fact, many researchers have proposed semantic-based
similarity measures by utilizing text annotation through external thesauruses
like WordNet (a lexical database). In this paper, we define a semantic
similarity measure based on documents represented in topic maps. Topic maps are
rapidly becoming an industrial standard for knowledge representation with a
focus for later search and extraction. The documents are transformed into a
topic map based coded knowledge and the similarity between a pair of documents
is represented as a correlation between the common patterns. The experimental
studies on the text mining datasets reveal that this new similarity measure is
more effective as compared to commonly used similarity measures in text
clustering.
","Muhammad Rafi, Sundus Hassan, Mohammad Shahid Shaikh","Fri, 17 Aug 2012 15:49:38 GMT (438kb)",Information Retrieval (cs.IR),Content-based Text Categorization using Wikitology
"In this research, we propose a method to trace scientists' research trends
realtimely. By monitoring the downloads of scientific articles in the journal
of Scientometrics for 744 hours, namely one month, we investigate the download
statistics. Then we aggregate the keywords in these downloaded research papers,
and analyze the trends of article downloading and keyword downloading.
Furthermore, taking both the download of keywords and articles into
consideration, we design a method to detect the emerging research trends. We
find that in scientometrics field, social media, new indices to quantify
scientific productivity (g-index), webometrics, semantic, text mining, open
access are emerging fields that scientometrics researchers are focusing on.
","Xianwen Wang, Zhi Wang, Shenmeng Xu","Tue, 7 Aug 2012 07:08:21 GMT (778kb) [v2] Thu, 13 Dec 2012 05:36:34 GMT (916kb)",Digital Libraries (cs.DL),Tracing scientist's research trends realtimely
"The tremendous expanse of search engines, dictionary and thesaurus storage,
and other text mining applications, combined with the popularity of readily
available scanning devices and optical character recognition tools, has
necessitated efficient storage, retrieval and management of massive text
databases for various modern applications. For such applications, we propose a
novel data structure, INSTRUCT, for efficient storage and management of
sequence databases. Our structure uses bit vectors for reusing the storage
space for common triplets, and hence, has a very low memory requirement.
INSTRUCT efficiently handles prefix and suffix search queries in addition to
the exact string search operation by iteratively checking the presence of
triplets. We also propose an extension of the structure to handle substring
search efficiently, albeit with an increase in the space requirements. This
extension is important in the context of trie-based solutions which are unable
to handle such queries efficiently. We perform several experiments portraying
that INSTRUCT outperforms the existing structures by nearly a factor of two in
terms of space requirements, while the query times are better. The ability to
handle insertion and deletion of strings in addition to supporting all kinds of
queries including exact search, prefix/suffix search and substring search makes
INSTRUCT a complete data structure.
","Sourav Dutta, Arnab Bhattacharya","Mon, 2 Jul 2012 12:38:47 GMT (67kb,D) [v2] Tue, 3 Jul 2012 04:54:37 GMT (67kb,D)",Databases (cs.DB),INSTRUCT: Space-Efficient Structure for Indexing and Complete Query Management of String Databases
"As one of the simplest probabilistic topic modeling techniques, latent
Dirichlet allocation (LDA) has found many important applications in text
mining, computer vision and computational biology. Recent training algorithms
for LDA can be interpreted within a unified message passing framework. However,
message passing requires storing previous messages with a large amount of
memory space, increasing linearly with the number of documents or the number of
topics. Therefore, the high memory usage is often a major problem for topic
modeling of massive corpora containing a large number of topics. To reduce the
space complexity, we propose a novel algorithm without storing previous
messages for training LDA: tiny belief propagation (TBP). The basic idea of TBP
relates the message passing algorithms with the non-negative matrix
factorization (NMF) algorithms, which absorb the message updating into the
message passing process, and thus avoid storing previous messages. Experimental
results on four large data sets confirm that TBP performs comparably well or
even better than current state-of-the-art training algorithms for LDA but with
a much less memory consumption. TBP can do topic modeling when massive corpora
cannot fit in the computer memory, for example, extracting thematic topics from
7 GB PUBMED corpora on a common desktop computer with 2GB memory.
","Jia Zeng, Zhi-Qiang Liu, Xiao-Qin Cao","Wed, 6 Jun 2012 08:34:43 GMT (2235kb) [v2] Fri, 8 Jun 2012 14:07:26 GMT (2239kb)",Learning (cs.LG),Memory-Efficient Topic Modeling
"Many words in documents recur very frequently but are essentially meaningless
as they are used to join words together in a sentence. It is commonly
understood that stop words do not contribute to the context or content of
textual documents. Due to their high frequency of occurrence, their presence in
text mining presents an obstacle to the understanding of the content in the
documents. To eliminate the bias effects, most text mining software or
approaches make use of stop words list to identify and remove those words.
However, the development of such top words list is difficult and inconsistent
between textual sources. This problem is further aggravated by sources such as
Twitter which are highly repetitive or similar in nature. In this paper, we
will be examining the original work using term frequency, inverse document
frequency and term adjacency for developing a stop words list for the Twitter
data source. We propose a new technique using combinatorial values as an
alternative measure to effectively list out stop words.
",Murphy Choy,"Tue, 29 May 2012 15:37:46 GMT (234kb)",Information Retrieval (cs.IR),Effective Listings of Function Stop words for Twitter
"Web 2.0 applications like Twitter or Facebook create a continuous stream of
information. This demands new ways of analysis in order to offer insight into
this stream right at the moment of the creation of the information, because
lots of this data is only relevant within a short period of time. To address
this problem real time search engines have recently received increased
attention. They take into account the continuous flow of information
differently than traditional web search by incorporating temporal and social
features, that describe the context of the information during its creation.
Standard approaches where data first get stored and then is processed from a
peristent storage suffer from latency. We want to address the fluent and rapid
nature of text stream by providing an event based approach that analyses
directly the stream of information. In a first step we want to define the
difference between real time search and traditional search to clarify the
demands in modern text filtering. In a second step we want to show how event
based features can be used to support the tasks of real time search engines.
Using the example of Twitter we present in this paper a way how to combine an
event based approach with text mining and information filtering concepts in
order to classify incoming information based on stream features. We calculate
stream dependant features and feed them into a neural network in order to
classify the text streams. We show the separative capabilities of event based
features as the foundation for a real time search engine.
","Andreas Bauer, Christian Wolff","Mon, 16 Apr 2012 04:50:13 GMT (188kb) [v2] Fri, 28 Jun 2013 12:31:37 GMT (187kb)",Information Retrieval (cs.IR),Event based classification of Web 2.0 text streams
"Frequently asked questions (FAQs) are a popular way to document software
development knowledge. As creating such documents is expensive, this paper
presents an approach for automatically extracting FAQs from sources of software
development discussion, such as mailing lists and Internet forums, by combining
techniques of text mining and natural language processing. We apply the
approach to popular mailing lists and carry out a survey among software
developers to show that it is able to extract high-quality FAQs that may be
further improved by experts.
","Stefan Hen, Martin Monperrus (INRIA Lille - Nord Europe), Mira Mezini","Fri, 23 Mar 2012 07:13:06 GMT (184kb)",Software Engineering (cs.SE),Semi-Automatically Extracting FAQs to Improve Accessibility of Software Development Knowledge
"Literature-based knowledge discovery method was introduced by Dr. Swanson in
1986. He hypothesized a connection between Raynaud's phenomenon and dietary
fish oil, the field of literature-based discovery (LBD) was born from then on.
During the subsequent two decades, LBD's research attracts some scientists
including information science, computer science, and biomedical science, etc..
It has been a part of knowledge discovery and text mining. This paper
summarizes the development of recent years about LBD and presents two parts,
methodology research and applied research. Lastly, some problems are pointed as
future research directions.
","Xiaoyong Liu, Hui Fu","Fri, 16 Mar 2012 03:33:06 GMT (132kb)",Digital Libraries (cs.DL),Literature-based knowledge discovery: the state of the art
"Concept Relation Discovery and Innovation Enabling Technology (CORDIET), is a
toolbox for gaining new knowledge from unstructured text data. At the core of
CORDIET is the C-K theory which captures the essential elements of innovation.
The tool uses Formal Concept Analysis (FCA), Emergent Self Organizing Maps
(ESOM) and Hidden Markov Models (HMM) as main artifacts in the analysis
process. The user can define temporal, text mining and compound attributes. The
text mining attributes are used to analyze the unstructured text in documents,
the temporal attributes use these document's timestamps for analysis. The
compound attributes are XML rules based on text mining and temporal attributes.
The user can cluster objects with object-cluster rules and can chop the data in
pieces with segmentation rules. The artifacts are optimized for efficient data
analysis; object labels in the FCA lattice and ESOM map contain an URL on which
the user can click to open the selected document.
","Jonas Poelmans, Paul Elzinga, Alexey Neznanov, Stijn Viaene, Sergei O. Kuznetsov, Dmitry Ignatov, Guido Dedene","Mon, 13 Feb 2012 23:19:51 GMT (415kb)",Artificial Intelligence (cs.AI),Concept Relation Discovery and Innovation Enabling Technology (CORDIET)
"Text mining is becoming vital as Web 2.0 offers collaborative content
creation and sharing. Now Researchers have growing interest in text mining
methods for discovering knowledge. Text mining researchers come from variety of
areas like: Natural Language Processing, Computational Linguistic, Machine
Learning, and Statistics. A typical text mining application involves
preprocessing of text, stemming and lemmatization, tagging and annotation,
deriving knowledge patterns, evaluating and interpreting the results. There are
numerous approaches for performing text mining tasks, like: clustering,
categorization, sentimental analysis, and summarization. There is a growing
need to standardize the evaluation of these tasks. One major component of
establishing standardization is to provide standard datasets for these tasks.
Although there are various standard datasets available for traditional text
mining tasks, but there are very few and expensive datasets for blog-mining
task. Blogs, a new genre in web 2.0 is a digital diary of web user, which has
chronological entries and contains a lot of useful knowledge, thus offers a lot
of challenges and opportunities for text mining. In this paper, we report a new
indigenous dataset for Pakistani Political Blogosphere. The paper describes the
process of data collection, organization, and standardization. We have used
this dataset for carrying out various text mining tasks for blogosphere, like:
blog-search, political sentiments analysis and tracking, identification of
influential blogger, and clustering of the blog-posts. We wish to offer this
dataset free for others who aspire to pursue further in this domain.
","Mehwish Aziz, Muhammad Rafi","Tue, 10 Jan 2012 15:18:38 GMT (91kb)",Artificial Intelligence (cs.AI),Pbm: A new dataset for blog mining
"Latent Dirichlet allocation (LDA) is an important hierarchical Bayesian model
for probabilistic topic modeling, which attracts worldwide interests and
touches on many important applications in text mining, computer vision and
computational biology. This paper introduces a topic modeling toolbox (TMBP)
based on the belief propagation (BP) algorithms. TMBP toolbox is implemented by
MEX C++/Matlab/Octave for either Windows 7 or Linux. Compared with existing
topic modeling packages, the novelty of this toolbox lies in the BP algorithms
for learning LDA-based topic models. The current version includes BP algorithms
for latent Dirichlet allocation (LDA), author-topic models (ATM), relational
topic models (RTM), and labeled LDA (LaLDA). This toolbox is an ongoing project
and more BP-based algorithms for various topic models will be added in the near
future. Interested users may also extend BP algorithms for learning more
complicated topic models. The source codes are freely available under the GNU
General Public Licence, Version 1.0 at this https URL
",Jia Zeng,"Wed, 4 Jan 2012 07:07:06 GMT (15kb) [v2] Thu, 5 Apr 2012 06:48:35 GMT (9kb)",Learning (cs.LG),A Topic Modeling Toolbox Using Belief Propagation
"Nonnegative matrix factorization has been widely applied in face recognition,
text mining, as well as spectral analysis. This paper proposes an alternating
proximal gradient method for solving this problem. With a uniformly positive
lower bound assumption on the iterates, any limit point can be proved to
satisfy the first-order optimality conditions. A Nesterov-type extrapolation
technique is then applied to accelerate the algorithm. Though this technique is
at first used for convex program, it turns out to work very well for the
non-convex nonnegative matrix factorization problem. Extensive numerical
experiments illustrate the efficiency of the alternating proximal gradient
method and the accleration technique. Especially for real data tests, the
accelerated method reveals high superiority to state-of-the-art algorithms in
speed with comparable solution qualities.
",Yangyang Xu,"Thu, 22 Dec 2011 18:22:59 GMT (362kb,D) [v2] Sat, 29 Dec 2012 17:43:05 GMT (0kb,I) [v3] Mon, 11 Feb 2013 17:54:57 GMT (0kb,I)",Information Theory (cs.IT),Alternating proximal gradient method for nonnegative matrix factorization
